,aid,aidtype,aidname,aiddesc,aidsrcid,aidsrcname,aidextid,aidmdate,cids,sids,geneids,aidcategories,protacxns,depcatg,pmids,rnai,ecs,repacxns,taxids,cellids,targettaxid,annotation,partial_agonist_desc,partial_agonist_aidname,agonist_desc,agonist_aidname,antagonist_desc,antagonist_aidname
0,1673112,Literature-derived,Displacement of [3H]-Diprenorphine from recombinant full length human mu opioid receptor expressed in CHO-K1 cells assessed as residual binding level for radioligand at 10 uM incubated for 60 mins by scintillation counting analysis relative to control,"Title: VU6005806/AZN-00016130, an advanced M positive allosteric modulator (PAM) profiled as a potential preclinical development candidate._||_Abstract: This letter describes progress towards an M PAM preclinical candidate that resulted in the discovery of VU6005806/AZN-00016130. While the thieno[2,3-c]pyridazine core has been a consistent feature of key M PAMs, no work had previously been reported with respect to alternate functionality at the C3 position of the pyridazine ring. Here, we detail new chemistry and analogs that explored this region, and quickly led to VU6005806/AZN-00016130, which was profiled as a putative candidate. While, the β-amino carboxamide moiety engendered solubility limited absorption in higher species precluding advancement (or requiring extensive pharmaceutical sciences formulation), VU6005806/AZN-00016130 represents a new, high quality preclinical in vivo probe.",43,ChEMBL,CHEMBL4667528,20220318,134263768,461557059,4988,,P35372,Curation Efforts|Research and Development,31113706,0,,P35372,9606,,,,0,0,0,0,0,0
6,1676706,Literature-derived,Displacement of [3H]DAMGO from human recombinant mu receptor at 10 uM after 120 mins by scintillation counting analysis relative to control,"Title: Discovery of VU6027459: A First-in-Class Selective and CNS Penetrant mGlu Positive Allosteric Modulator Tool Compound._||_Abstract: Herein, we report the discovery of the first selective and CNS penetrant mGlu PAM (VU6027459) derived from a 'molecular switch' within a selective mGlu NAM chemotype. VU6027459 displayed CNS penetration in both mice (K = 2.74) and rats (K= 4.78), it was orally bioavailable in rats (%F = 69.5), and undesired activity at DAT was ablated.",43,ChEMBL,CHEMBL4671122,20220318,162654767|162660757,461531283|461539738,4988,,P35372,Curation Efforts|Research and Development,32944146,0,,P35372,9606,,,,0,0,0,0,0,0
10,1679107,Literature-derived,Binding affinity to MOR (unknown origin) at <= 1 uM,"Title: Synthesis and sigma receptor affinity of spiro[[2]benzopyran-1,1-cyclohexanes] with an exocyclic amino moiety in the 3-position_||_Abstract: The main functions of sigma1 receptors include the modulation of release and reuptake of neurotransmitters, the regulation of ion channels and the influence on intracellular signaling through modulation of calcium levels. Due to these properties, sigma1 receptors are interesting drug targets for the treatment of various neurological disorders, pain and cancer. In order to modify the distance between the pharmacophoric elements (the benzene ring of 2-benzopyran and an amino moiety), a set of spiro[[2]benzopyran-1,1-cyclohexan]-3-amines was synthesized. The key step of the synthesis was a Parham cyclization of 1-bromo-2-(2-bromoethyl)benzene (6) with the mono ketal 7 of cyclohexane-1,3-dione, which led in a one-pot reaction to the spirocyclic framework 8. Reductive amination of ketone 9 stereoselectively provided secondary amines cis-4, which were methylated to afford tertiary amines cis-5. Whereas spirocyclic compounds cis-4a and cis-5a bearing a benzyl moiety at the exocyclic amino moiety showed rather low sigma1 affinity, the corresponding cyclohexylmethyl derivatives cis-4b and cis-5b exhibited low nanomolar sigma1 affinity. The secondary amine cis-4b displayed the highest sigma1 receptor affinity (Ki = 5.4 nM) in this series. Methylation of the secondary amine cis-4b led to a slightly decreased sigma1 receptor affinity of cis-5b (Ki = 15 nM).",43,ChEMBL,CHEMBL4673758,20220318,162672290,461556225,4988,,P35372,Curation Efforts|Research and Development,34046612,0,,P35372,9606,,,,0,0,0,0,0,0
11,1679113,Confirmatory,Binding affinity to MOR (unknown origin),"Title: Synthesis and sigma receptor affinity of spiro[[2]benzopyran-1,1-cyclohexanes] with an exocyclic amino moiety in the 3-position_||_Abstract: The main functions of sigma1 receptors include the modulation of release and reuptake of neurotransmitters, the regulation of ion channels and the influence on intracellular signaling through modulation of calcium levels. Due to these properties, sigma1 receptors are interesting drug targets for the treatment of various neurological disorders, pain and cancer. In order to modify the distance between the pharmacophoric elements (the benzene ring of 2-benzopyran and an amino moiety), a set of spiro[[2]benzopyran-1,1-cyclohexan]-3-amines was synthesized. The key step of the synthesis was a Parham cyclization of 1-bromo-2-(2-bromoethyl)benzene (6) with the mono ketal 7 of cyclohexane-1,3-dione, which led in a one-pot reaction to the spirocyclic framework 8. Reductive amination of ketone 9 stereoselectively provided secondary amines cis-4, which were methylated to afford tertiary amines cis-5. Whereas spirocyclic compounds cis-4a and cis-5a bearing a benzyl moiety at the exocyclic amino moiety showed rather low sigma1 affinity, the corresponding cyclohexylmethyl derivatives cis-4b and cis-5b exhibited low nanomolar sigma1 affinity. The secondary amine cis-4b displayed the highest sigma1 receptor affinity (Ki = 5.4 nM) in this series. Methylation of the secondary amine cis-4b led to a slightly decreased sigma1 receptor affinity of cis-5b (Ki = 15 nM).",43,ChEMBL,CHEMBL4673764,20220318,162659961,461538615,4988,,P35372,Curation Efforts|Research and Development,34046612,0,,P35372,9606,,,,0,0,0,0,0,0
21,1682287,Literature-derived,Inhibition of human Mu-type opioid receptor at 10 uM relative to control,"Title: Pyridine alkaloids with activity in the central nervous system._||_Abstract: This review discusses all pyridine alkaloids with CNS activity, their therapeutic potential, and the interesting array of sources whence they originate.",43,ChEMBL,CHEMBL4676938,20220318,854019,103707730,4988,,P35372,Curation Efforts|Research and Development,33120080,0,,P35372,9606,,,,0,0,0,0,0,0
35,1685548,Literature-derived,Inhibition of human mu-opioid receptor at 10 uM,"Title: Natural product inspired optimization of a selective TRPV6 calcium channel inhibitor_||_Abstract: Transient receptor potential vanilloid 6 (TRPV6) is a calcium channel implicated in multifactorial diseases and overexpressed in numerous cancers. We recently reported the phenyl-cyclohexyl-piperazine cis-22a as the first submicromolar TRPV6 inhibitor. This inhibitor showed a seven-fold selectivity against the closely related calcium channel TRPV5 and no activity on store-operated calcium channels (SOC), but very significant off-target effects and low microsomal stability. Here, we surveyed analogues incorporating structural features of the natural product capsaicin and identified 3OG, a new oxygenated analog with similar potency against TRPV6 (IC50 = 0.082 +/- 0.004 microM) and ion channel selectivity, but with high microsomal stability and very low off-target effects. This natural product-inspired inhibitor does not exhibit any non-specific toxicity effects on various cell lines and is proposed as a new tool compound to test pharmacological inhibition of TRPV6 mediated calcium flux in disease models.",43,ChEMBL,CHEMBL4680558,20220318,155804579,461516429,4988,,P35372,Curation Efforts|Research and Development,33479695,0,,P35372,9606,,,,0,0,0,0,0,0
36,1692673,Literature-derived,Inhibition of mu-type opioid receptor (unknown origin) at 10 uM relative to control,"Title: The Essential Medicinal Chemistry of Cannabidiol (CBD)._||_Abstract: This Perspective of the published essential medicinal chemistry of cannabidiol (CBD) provides evidence that the popularization of CBD-fortified or CBD-labeled health products and CBD-associated health claims lacks a rigorous scientific foundation. CBD's reputation as a cure-all puts it in the same class as other 'natural' panaceas, where valid ethnobotanicals are reduced to single, purportedly active ingredients. Such reductionist approaches oversimplify useful, chemically complex mixtures in an attempt to rationalize the commercial utility of natural compounds and exploit the 'natural' label. Literature evidence associates CBD with certain semiubiquitous, broadly screened, primarily plant-based substances of undocumented purity that interfere with bioassays and have a low likelihood of becoming therapeutic agents. Widespread health challenges and pandemic crises such as SARS-CoV-2 create circumstances under which scientists must be particularly vigilant about healing claims that lack solid foundational data. Herein, we offer a critical review of the published medicinal chemistry properties of CBD, as well as precise definitions of CBD-containing substances and products, distilled to reveal the essential factors that impact its development as a therapeutic agent.",43,ChEMBL,CHEMBL4687683,20220318,644019,103460177,4988,,P35372,Curation Efforts|Research and Development,32804502,0,,P35372,9606,,,,0,0,0,0,0,0
37,1692682,Confirmatory,Inhibition of mu-type opioid receptor (unknown origin),"Title: The Essential Medicinal Chemistry of Cannabidiol (CBD)._||_Abstract: This Perspective of the published essential medicinal chemistry of cannabidiol (CBD) provides evidence that the popularization of CBD-fortified or CBD-labeled health products and CBD-associated health claims lacks a rigorous scientific foundation. CBD's reputation as a cure-all puts it in the same class as other 'natural' panaceas, where valid ethnobotanicals are reduced to single, purportedly active ingredients. Such reductionist approaches oversimplify useful, chemically complex mixtures in an attempt to rationalize the commercial utility of natural compounds and exploit the 'natural' label. Literature evidence associates CBD with certain semiubiquitous, broadly screened, primarily plant-based substances of undocumented purity that interfere with bioassays and have a low likelihood of becoming therapeutic agents. Widespread health challenges and pandemic crises such as SARS-CoV-2 create circumstances under which scientists must be particularly vigilant about healing claims that lack solid foundational data. Herein, we offer a critical review of the published medicinal chemistry properties of CBD, as well as precise definitions of CBD-containing substances and products, distilled to reveal the essential factors that impact its development as a therapeutic agent.",43,ChEMBL,CHEMBL4687692,20220318,644019,103460177,4988,,P35372,Curation Efforts|Research and Development,32804502,0,,P35372,9606,,,,0,0,0,0,0,0
68,1718175,Confirmatory,Binding affinity to mu opioid receptor (unknown origin),"Title: Small Molecules Selectively Targeting Sigma-1 Receptor for the Treatment of Neurological Diseases._||_Abstract: The sigma-1 (σ) receptor, an enigmatic protein originally classified as an opioid receptor subtype, is now understood to possess unique structural and functional features of its own and play critical roles to widely impact signaling transduction by interacting with receptors, ion channels, lipids, and kinases. The σ receptor is implicated in modulating learning, memory, emotion, sensory systems, neuronal development, and cognition and accordingly is now an actively pursued drug target for various neurological and neuropsychiatric disorders. Evaluation of the five selective σ receptor drug candidates (pridopidine, ANAVEX2-73, SA4503, S1RA, and T-817MA) that have entered clinical trials has shown that reaching clinical approval remains an evasive and important goal. This review provides up-to-date information on the selective targeting of σ receptors, including their history, function, reported crystal structures, and roles in neurological diseases, as well as a useful collation of new chemical entities as σ selective orthosteric ligands or allosteric modulators.",43,ChEMBL,CHEMBL4723559,20220318,441278,103178693,4988,,P35372,Curation Efforts|Research and Development,33111525,0,,P35372,9606,,,,0,0,0,0,0,0
69,1725044,Literature-derived,Inhibition of MOR (unknown origin) relative to control,"Title: Synthesis and SAR Studies of 1H-Pyrrolo[2,3-b]pyridine-2-carboxamides as Phosphodiesterase 4B (PDE4B) Inhibitors._||_Abstract: Herein we report the synthesis, SAR, and biological evaluation of a series of 1H-pyrrolo[2,3-b]pyridine-2-carboxamide derivatives as selective and potent PDE4B inhibitors. Compound 11h is a PDE4B preferring inhibitor and exhibited acceptable in vitro ADME and significantly inhibited TNF-α release from macrophages exposed to pro-inflammatory stimuli (i.e., lipopolysaccharide and the synthetic bacterial lipopeptide Pam3Cys). In addition, 11h was selective against a panel of CNS receptors and represents an excellent lead for further optimization and preclinical testing in the setting of CNS diseases.",43,ChEMBL,CHEMBL4730715,20220318,162665987,461547259,4988,,P35372,Curation Efforts|Research and Development,33062163,0,,P35372,9606,,,,0,0,0,0,0,0
75,1726158,Confirmatory,Antagonist activity at human mu opioid receptor expressed in CHO cells co- expressing Gqi5 assessed as decrease in DAMGO-induced intracellular calcium mobilization incubated for 15 mins followed by DAMGO addition by Fluo-AM dye based fluorescence assay,"Title: Bivalent Ligand Aiming Putative Mu Opioid Receptor and Chemokine Receptor CXCR4 Dimers in Opioid Enhanced HIV-1 Entry._||_Abstract: A bivalent compound 1a featuring both a mu opioid receptor (MOR) and a CXCR4 antagonist pharmacophore (naltrexone and IT1t) was designed and synthesized. Further binding and functional studies demonstrated 1a acting as a MOR and a CXCR4 dual antagonist with reasonable binding affinities at both receptors. Furthermore, compound 1a seemed more effective than a combination of IT1t and naltrexone in inhibiting HIV entry at the presence of morphine. Additional molecular modeling results suggested that 1a may bind with the putative MOR-CXCR4 heterodimer to induce its anti-HIV activity. Collectively, bivalent ligand 1a may serve as a promising lead to develop chemical probes targeting the putative MOR-CXCR4 heterodimer in comprehending opioid exacerbated HIV-1 invasion.",43,ChEMBL,CHEMBL4731829,20220318,5360515|162653231|162666072,131283791|461529083|461547391,4988,,P35372,Curation Efforts|Research and Development,33214847,0,,P35372,9606,,,,0,0,1,1,1,1
86,1745149,Other,MU/H Eurofins SafetyScreen44 (BI),MU/H Eurofins SafetyScreen44 (BI),43,ChEMBL,CHEMBL4801303,20220318,46853762,318398468,4988,,P35372,Curation Efforts|Research and Development,,0,,P35372,9606,,,,0,0,0,0,0,0
87,1745213,Other,mu (MOP) (h) Eurofins-Cerep binding assay,mu (MOP) (h) Eurofins-Cerep binding assay,43,ChEMBL,CHEMBL4801367,20220318,150189198,461563590,4988,,P35372,Curation Efforts|Research and Development,,0,,P35372,9606,,,,0,0,0,0,0,0
88,1745339,Other,Mu (h) CEREP screen,Mu (h) CEREP screen,43,ChEMBL,CHEMBL4801493,20220318,162677478,461563589,4988,,P35372,Curation Efforts|Research and Development,,0,,P35372,9606,,,,0,0,0,0,0,0
90,82363,Literature-derived,Activity was determined for the compound against the Mu opioid receptor by GTPgammaS functional assay using recombinant HEK293 cells; PA: Partial antagonist,Title: Design and synthesis of novel small molecule N/OFQ receptor antagonists._||_Abstract: Small molecule N/OFQ receptor antagonists were designed and synthesized to further investigate the therapeutic potential of N/OFQ receptor modulators. The resulting octahydrobenzimidazol-2-ones 14 and 23 show excellent antagonistic activity towards both N/OFQ and mu receptors with high affinity to the human N/OFQ receptor.,43,ChEMBL,CHEMBL691173,20181001,9902583|10154848|10202108,103197998|103198079|103198402,4988,,P35372,Curation Efforts|Research and Development,14980696,0,,P35372,9606,45.0,,,0,0,1,1,1,1
106,148349,Literature-derived,"Incorporation of [35S]GTP-gamma-S, into CHO membranes expressing human Opioid receptor mu 1","Title: Syntheses and opioid receptor binding affinities of 8-amino-2,6-methano-3-benzazocines._||_Abstract: 8-Amino-2,6-methano-3-benzazocine derivatives have been made using Pd-catalyzed amination procedures, and their affinities for opioid receptors were assessed. The 8-amino group was hypothesized to be a replacement for the prototypic 8-OH substituent for 2,6-methano-3-benzazocines and related opiates. This OH group is generally required for binding yet is implicated in unfavorable pharmacokinetic characteristics such as low oral bioavailability and rapid clearance via O-glucuronidation. The core structures in which the 8-OH group was replaced were cyclazocine and its enantiomers, ethylketocyclazocine and its enantiomers, ketocyclazocine, and Mr2034. Many new analogues had high affinity for opioid receptors with several in the subnanomolar range. Highest affinity was seen in analogues with secondary 8-(hetero)arylamino appendages. Binding to opioid receptors was enantioselective with the (2R,6R,11R)-configuration preferred and high selectivity for mu and kappa over delta opioid receptors was observed within the series. Several derivatives were shown to have intrinsic opioid-receptor-mediated activity in [(35)S]GTPgammaS assays.",43,ChEMBL,CHEMBL749739,20181017,3037926|10334091|11779453|44273397|44380980|44380994|73351393,103186171|103241212|103425120|103425148|103425149|103425709|174505237,4988,,P35372,Curation Efforts|Research and Development,12593663,0,,P35372,9606,,,,0,0,0,0,0,0
112,148475,Confirmatory,Inhibition of total opioid receptor by displacing 0.5 nM [3H]bremazocine in guinea pig brain membrane,"Title: O3-(2-carbomethoxyallyl) ethers of opioid ligands derived from oxymorphone, naltrexone, etorphine, diprenorphine, norbinaltorphimine, and naltrindole. Unexpected O3-dealkylation in the opioid radioligand displacement assay._||_Abstract: O3-(2-Carbomethoxyallyl) ether derivatives of some phenolic 4,5-epoxymorphinan opioid ligands have been prepared in a simple one-step procedure, and their behavior in the radioligand receptor assay was compared to their phenolic precursors. These O3-ether ligands appeared to show significant affinity for opioid receptors, about 2-fold less than the parent phenols, and their receptor selectivities were similar. However, on close examination of the stability of a representative ether 2b in the radioligand displacement assay, considerable O3-dealkylation was observed. The dealkylation process occurred even after denaturation of the proteins of the membrane preparation, and it occurred in the presence of model nucleophiles imidazole and thiophenol. Thus, what apparently was unusual activity is explained by O3-dealkylation to the parent phenol (e.g., 2a). Saturated ether analog 2c was not dealkylated under the conditions of the radioligand displacement assay and was a very weak opioid ligand. We conclude that the conversion of the O3(2-carbomethoxyallyl) ether electrophilic ligands to their parent phenols accounts for their activity in the opioid radioligand displacement assay.",43,ChEMBL,CHEMBL754005,20181013,1223|443408|644209|5284596|5284604|5360515|5480230|5486554|5497186|10026312|10046467|10321082|10346220|10350630|10414887|10455862|10455974|10459444|10481516,103170037|103189159|103250876|103279059|103381210|103381309|103381569|103381570|103381656|103381934|103381936|103381980|103382010|103416406|103697951|103698780|131283791|160708234|242084509,4985|4986|4988,,P35372|P41143|P41145,Curation Efforts|Research and Development,1335078,0,,P35372|P41143|P41145,10141,,,,0,0,0,0,0,0
115,148483,Confirmatory,Displacement of 0.5 nM [3H]bremazocine from opioid receptor sites in guinea pig membranes,"Title: Electrophilic gamma-lactone kappa-opioid receptor probes. Analogues of 2'-hydroxy-2-tetrahydrofurfuryl-5,9-dimethyl-6,7-benzomorphan diastereomers._||_Abstract: Benzomorphans with an electrophilic group in the nitrogen substituent were prepared as potentially irreversible ligands for the kappa-opioid receptor. These were synthesized from products of the reaction of normetazocine with the enantiomers of 5-(iodomethyl)-gamma-butyrolactone (11). alpha-Methylene gamma-lactones 5 and 7 and endocyclic alpha,beta-unsaturated gamma-lactones 8 and 9 were prepared from the corresponding saturated gamma-lactones 13 and 23 possessing the 'active' (1R,5R,9R)-benzomorphan stereochemistry. Only gamma-lactones 8, 9, 13, and 23, lacking the exocyclic methylene group, retain significant affinities for opioid receptor binding sites when compared with the reference compounds (2'S)-3 and (2'R)-3. As observed with these references compounds, greater binding affinity is also seen with gamma-lactone diastereomers having the 2'S stereochemistry in the nitrogen substituent. Although the gamma-lactones do not bind irreversibly in opioid receptor preparations, they do show kappa-receptor selectivities comparable to those observed for the reference compounds.",43,ChEMBL,CHEMBL755016,20181013,44460594|73346788,103283978|174489780,4985|4986|4988,,P35372|P41143|P41145,Curation Efforts|Research and Development,1652019,0,,P35372|P41143|P41145,10141,,,,0,0,0,0,0,0
116,148485,Literature-derived,IC50 of the morphine in the presence of the antagonist (10 nM) divided by the control IC50 (same preparation without antagonist) in guinea pig ileum,"Title: Opioid agonist and antagonist bivalent ligands. The relationship between spacer length and selectivity at multiple opioid receptors._||_Abstract: Bivalent ligands containing the oxymorphamine or naltrexamine pharmacophores connected to spacers of varying length were synthesized and evaluated for their selectivity at mu, kappa, and delta opioid receptors. The oxymorphamine bivalent ligands (1-8) behaved as mu agonists on the electrically stimulated guinea pig ileum longitudinal muscle preparation (GPI). The spacer that conferred peak agonist activity in these series contains a total of four glycyl units (n = 2). Binding studies with guinea pig brain membranes showed a qualitatively similar profile at mu receptors as a function of spacer length. Also, delta receptor selectivity increased as the spacer was lengthened. The naltrexamine bivalent ligands (9-13) effectively antagonized the mu receptor agonist morphine in the GPI at the same optimal spacer length (n = 2) as in the agonist series. However, the peak antagonism of ethylketazocine, a kappa receptor agonist, occurred with the bivalent ligand 9 containing the shortest spacer (n = 0), and it was found that 9 is the most selective kappa antagonist in the series. While receptor binding roughly parallels that of kappa antagonist activity in the GPI, no correlation between binding and antagonist activity was observed at mu opioid receptors. The possible significance of these results is discussed.",43,ChEMBL,CHEMBL752475,20200628,118718756,312365627,4985|4986|4988,,P35372|P41143|P41145,Curation Efforts|Research and Development,3020244,0,,P35372|P41143|P41145,10141,,,,0,0,1,1,1,1
117,148487,Literature-derived,Percent inhibition against opioid receptor in electrically stimulated longitudinal muscle of guinea pig ileum at 100 nM,"Title: Synthesis and biological activity of analogues of beta-chlornaltrexamine and beta-funaltrexamine at opioid receptors._||_Abstract: beta-Chlornaltrexamine and beta-funaltrexamine analogues 4-7 with different length 'arms' to which an electrophilic moiety is attached were synthesized in an effort to obtain affinity labels that would selectively and irreversibly block specific opioid receptor types and subtypes. One of the compounds, 4, was a potent, irreversible blocker of opioid receptors in the guinea pig ileum and mouse vas deferens preparations. The results of this study suggest that nucleophiles that are remote from the recognition locus are capable of alkylation by reactive electrophiles.",43,ChEMBL,CHEMBL752477,20181010,44298185|44298210,103241049|103241142,4985|4986|4988,,P35372|P41143|P41145,Curation Efforts|Research and Development,3020245,0,,P35372|P41143|P41145,10141,,,,0,0,0,0,0,0
120,148493,Literature-derived,The IC50 value of agonist (DADLE) in presence of antagonist (Compound 20 nM) divided by the control IC60 value with no antagonist in MVD (mouse vas deferens),"Title: Bimorphinans as highly selective, potent kappa opioid receptor antagonists.",43,ChEMBL,CHEMBL752482,20200628,11765092|71716677,103734719|164130554,4985|4986|4988,,P35372|P41143|P41145,Curation Efforts|Research and Development,3027336,0,,P35372|P41143|P41145,10141,,,,0,0,1,1,1,1
121,148495,Literature-derived,The IC50 value of agonist (morphine) in presence of antagonist (Compound 20 nM) divided by the control IC60 value with no antagonist in GPI (Guinea pig ileum),"Title: Bimorphinans as highly selective, potent kappa opioid receptor antagonists.",43,ChEMBL,CHEMBL752630,20200628,5360515|11765092|71716677,103734719|131283791|164130554,4985|4986|4988,,P35372|P41143|P41145,Curation Efforts|Research and Development,3027336,0,,P35372|P41143|P41145,10141,,,,0,0,1,1,1,1
