,aid,aidtype,aidname,aiddesc,aidsrcid,aidsrcname,aidextid,aidmdate,cids,sids,geneids,aidcategories,protacxns,depcatg,pmids,rnai,ecs,repacxns,taxids,cellids,targettaxid,annotation,partial_agonist_desc,partial_agonist_aidname,agonist_desc,agonist_aidname,antagonist_desc,antagonist_aidname
569,603163,Confirmatory,Displacement of [3H]-DAMGO from MOR-1 expressed in CHO cells after 150 mins,"Title: Generation of novel radiolabeled opiates through site-selective iodination._||_Abstract: Tritiated opioid radioligands have proven valuable in exploring opioid binding sites. However, tritium has many limitations. Its low specific activity and limited counting efficiency makes it difficult to examine low abundant, high affinity sites and its disposal is problematic due to the need to use organic scintillants and its relatively long half-life. To overcome these issues, we have synthesized both unlabeled and carrier-free radioiodinated iodobenzoyl derivatives of 6β-naltrexamine ((125)I-BNtxA, 18), 6β-naloxamine ((125)I-BNalA, 19) and 6β-oxymorphamine ((125)I-BOxyA, 20) with specific activities of 2100Ci/mmol. To optimize the utility of the radioligand, we designed a synthesis in which the radiolabel is incorporated in the last synthetic step, which required the selective iodination of the benzoyl moiety without incorporation into the phenolic A ring. Competition studies demonstrated high affinity of the unlabelled compounds for opioid receptors in transfected cell lines, as did the direct binding of the (125)I-ligands to the opioid receptors. The radioligand displayed very high sensitivity, enabling a marked reduction in tissue, as well as excellent signal/noise characteristics. These new (125)I-radioligands should prove valuable in future studies of opioid binding sites.",43,ChEMBL,CHEMBL1799266,20200629,51003467|56663008|56669900,134440606|134448326|134455996,4988,,P35372,Curation Efforts|Research and Development,21621410,0,,P35372,,197.0,,,0,0,0,0,0,0
570,603169,Confirmatory,Displacement of [125I]-IBNtxA from MOR-1 expressed in CHO cells,"Title: Generation of novel radiolabeled opiates through site-selective iodination._||_Abstract: Tritiated opioid radioligands have proven valuable in exploring opioid binding sites. However, tritium has many limitations. Its low specific activity and limited counting efficiency makes it difficult to examine low abundant, high affinity sites and its disposal is problematic due to the need to use organic scintillants and its relatively long half-life. To overcome these issues, we have synthesized both unlabeled and carrier-free radioiodinated iodobenzoyl derivatives of 6β-naltrexamine ((125)I-BNtxA, 18), 6β-naloxamine ((125)I-BNalA, 19) and 6β-oxymorphamine ((125)I-BOxyA, 20) with specific activities of 2100Ci/mmol. To optimize the utility of the radioligand, we designed a synthesis in which the radiolabel is incorporated in the last synthetic step, which required the selective iodination of the benzoyl moiety without incorporation into the phenolic A ring. Competition studies demonstrated high affinity of the unlabelled compounds for opioid receptors in transfected cell lines, as did the direct binding of the (125)I-ligands to the opioid receptors. The radioligand displayed very high sensitivity, enabling a marked reduction in tissue, as well as excellent signal/noise characteristics. These new (125)I-radioligands should prove valuable in future studies of opioid binding sites.",43,ChEMBL,CHEMBL1799272,20200629,5284596|5288826|5359371|5360515|5462471|10418702,103169185|103170037|103217856|123094338|131283791|134463632,4988,,P35372,Curation Efforts|Research and Development,21621410,0,,P35372,,197.0,,,0,0,0,0,0,0
571,603171,Confirmatory,Displacement of [125I]-IBOxyA from MOR-1 expressed in CHO cells,"Title: Generation of novel radiolabeled opiates through site-selective iodination._||_Abstract: Tritiated opioid radioligands have proven valuable in exploring opioid binding sites. However, tritium has many limitations. Its low specific activity and limited counting efficiency makes it difficult to examine low abundant, high affinity sites and its disposal is problematic due to the need to use organic scintillants and its relatively long half-life. To overcome these issues, we have synthesized both unlabeled and carrier-free radioiodinated iodobenzoyl derivatives of 6β-naltrexamine ((125)I-BNtxA, 18), 6β-naloxamine ((125)I-BNalA, 19) and 6β-oxymorphamine ((125)I-BOxyA, 20) with specific activities of 2100Ci/mmol. To optimize the utility of the radioligand, we designed a synthesis in which the radiolabel is incorporated in the last synthetic step, which required the selective iodination of the benzoyl moiety without incorporation into the phenolic A ring. Competition studies demonstrated high affinity of the unlabelled compounds for opioid receptors in transfected cell lines, as did the direct binding of the (125)I-ligands to the opioid receptors. The radioligand displayed very high sensitivity, enabling a marked reduction in tissue, as well as excellent signal/noise characteristics. These new (125)I-radioligands should prove valuable in future studies of opioid binding sites.",43,ChEMBL,CHEMBL1799274,20200629,5284596|5288826|5359371|5360515|5462471|10418702,103169185|103170037|103217856|123094338|131283791|134463632,4988,,P35372,Curation Efforts|Research and Development,21621410,0,,P35372,,197.0,,,0,0,0,0,0,0
572,607797,Confirmatory,Antagonist activity at human mu opioid receptor expressed in CHO cells coexpressing human recombinant MOR after 3 hrs by [35S]GTPgammaS binding assay,"Title: Probes for narcotic receptor mediated phenomena. 43. Synthesis of the ortho-a and para-a, and improved synthesis and optical resolution of the ortho-b and para-b oxide-bridged phenylmorphans: compounds with moderate to low opioid-receptor affinity._||_Abstract: N-Phenethyl-substituted ortho-a and para-a oxide-bridged phenylmorphans have been obtained through an improved synthesis and their binding affinity examined at the various opioid receptors. Although the N-phenethyl substituent showed much greater affinity for μ- and κ-opioid receptors than their N-methyl relatives (e.g., K(i)=167 nM and 171 nM at μ- and κ-receptors vs >2800 and 7500 nM for the N-methyl ortho-a oxide-bridged phenylmorphan), the a-isomers were not examined further because of their relatively low affinity. The N-phenethyl substituted ortho-b and para-b oxide-bridged phenylmorphans were also synthesized and their enantiomers were obtained using supercritical fluid chromatography. Of the four enantiomers, only the (+)-ortho-b isomer had moderate affinity for μ- and κ-receptors (K(i)=49 and 42 nM, respectively, and it was found to also have moderate μ- and κ-opioid antagonist activity in the [(35)S]GTP-γ-S assay (K(e)=31 and 26 nM).",43,ChEMBL,CHEMBL1809752,20200629,5284596|44588494|44588496|56666529|56676760|56676761|56680069,103170037|103645949|103645951|134444474|134456064|134456065|134459863,4988,,P35372,Curation Efforts|Research and Development,21684752,0,,P35372,9606,197.0,,,0,0,1,1,1,1
573,610911,Confirmatory,Displacement of [3H]DAMGO from human mu opioid receptor expressed in CHO-K1 cells after 60 mins by scintillation counting,"Title: Benzyl derivatives with in vitro binding affinity for human opioid and cannabinoid receptors from the fungus Eurotium repens._||_Abstract: Bioassay-guided fractionation of the fungus Eurotium repens resulted in the isolation of two new benzyl derivatives, (E)-2-(hept-1-enyl)-3-(hydroxymethyl)-5-(3-methylbut-2-enyl)benzene-1,4-diol (1) and (E)-4-(hept-1-enyl)-7-(3-methylbut-2-enyl)-2,3-dihydrobenzofuran-2,5-diol (2), along with seven known compounds (3-9) including five benzaldehyde compounds, flavoglaucin (3), tetrahydroauroglaucin (4), dihydroauroglaucin (5), auroglaucin (6), and 2-(2',3-epoxy-1',3'- heptadienyl)-6-hydroxy-5-(3-methyl-2-butenyl)benzaldehyde (7), one diketopiperazine alkaloid, echinulin (8), and 5,7-dihydroxy-4-methylphthalide (9). The chemical structures of these compounds were established on the basis of extensive 1D and 2D NMR and HRMS data. Compounds 1-4 and 6 showed good binding affinity for human opioid or cannabinoid receptors. These findings have important implications for psychoactive studies with this class of compounds.",43,ChEMBL,CHEMBL1814860,20180919,119037|14355117,134453690|134459059,4988,,P35372,Curation Efforts|Research and Development,21667972,0,,P35372,9606,198.0,,,0,0,0,0,0,0
578,617209,Literature-derived,Inhibition of mu opioid receptor at 10 uM by NIMH PDSP,"Title: N-Arylalkyl-2-azaadamantanes as cage-expanded polycarbocyclic sigma (σ) receptor ligands._||_Abstract: A series of racemic N-arylalkyl-2-azaadamantan-1-ols (9-15) and the corresponding deoxygenated, achiral N-arylalkyl-2-azaadamantanes (23-29) were synthesized and screened in competition binding assays against a panel of CNS targets. Adamantyl hemiaminals 9-15 displayed generally low affinity for both σ(1) (K(i) values= 294-1950 nM) and σ(2) receptors (K(i) values=201-1020 nM), and negligible affinity for 42 other CNS proteins. Deoxygenation of 9-15 to give the corresponding achiral azaadamantanes 23-29 greatly improved affinity for σ(1) (K(i) values=8.3-239 nM) and σ(2) receptors (K(i) values=34-312 nM).",43,ChEMBL,CHEMBL1826466,20200629,56665109|56672196|56675439|56682093,134442395|134450449|134454026|134461651,4988,,P35372,Curation Efforts|Research and Development,21788137,0,,P35372,,,,,0,0,0,0,0,0
579,619435,Literature-derived,Displacement of radioligand from opioid mu receptor assessed as 50% receptor inhibition at 10'-5 M,"Title: Synthesis and pharmacological evaluation of indole-based sigma receptor ligands._||_Abstract: A series of novel indole-based analogs were prepared and their affinities for sigma receptors were determined using in vitro radioligand binding assays. The results of this study identified several compounds with nanomolar sigma-2 affinity and significant selectivity over sigma-1 receptors. In particular, 2-(4-(3-(4-fluorophenyl)indol-1-yl)butyl)-6,7-dimethoxy-1,2,3,4-tetrahydroisoquinoline (9f) was found to display high affinity at sigma-2 receptors with good selectivity (σ-1/σ-2 = 395). The pharmacological binding profile for this compound was established with other relevant non-sigma sites.",43,ChEMBL,CHEMBL1831386,20200629,54753271,134452893,4988,,P35372,Curation Efforts|Research and Development,21899931,0,,P35372,,,,,0,0,0,0,0,0
580,621021,Confirmatory,Partial agonist activity at human MOP receptor expressed in CHO cells assessed as stimulation of [35S]GTPgammaS binding after 60 mins by scintillation counting,"Title: Structural determinants of opioid and NOP receptor activity in derivatives of buprenorphine._||_Abstract: The unique pharmacological profile of buprenorphine has led to its considerable success as an analgesic and as a treatment agent for drug abuse. Activation of nociceptin/orphanin FQ peptide (NOP) receptors has been postulated to account for certain aspects of buprenorphine's behavioral profile. In order to investigate the role of NOP activation further, a series of buprenorphine analogues has been synthesized with the aim of increasing affinity for the NOP receptor. Binding and functional assay data on these new compounds indicate that the area around C20 in the orvinols is key to NOP receptor activity, with several compounds displaying higher affinity than buprenorphine. One compound, 1b, was found to be a mu opioid receptor partial agonist of comparable efficacy to buprenorphine but with higher efficacy at NOP receptors.",43,ChEMBL,CHEMBL1838554,20180919,5462471|9848990|54756989|56658044|56664973,103217856|134434452|134442153|134442154|175265278,4988,,P35372,Curation Efforts|Research and Development,21866885,0,,P35372,9606,197.0,,,1,1,1,1,0,0
581,621025,Literature-derived,Partial agonist activity at human MOP receptor expressed in CHO cells assessed as maximal stimulation of [35S]GTPgammaS binding after 60 mins by scintillation counting relative to DAMGO,"Title: Structural determinants of opioid and NOP receptor activity in derivatives of buprenorphine._||_Abstract: The unique pharmacological profile of buprenorphine has led to its considerable success as an analgesic and as a treatment agent for drug abuse. Activation of nociceptin/orphanin FQ peptide (NOP) receptors has been postulated to account for certain aspects of buprenorphine's behavioral profile. In order to investigate the role of NOP activation further, a series of buprenorphine analogues has been synthesized with the aim of increasing affinity for the NOP receptor. Binding and functional assay data on these new compounds indicate that the area around C20 in the orvinols is key to NOP receptor activity, with several compounds displaying higher affinity than buprenorphine. One compound, 1b, was found to be a mu opioid receptor partial agonist of comparable efficacy to buprenorphine but with higher efficacy at NOP receptors.",43,ChEMBL,CHEMBL1838558,20180919,5462471|9848990|54756989|54756990|56658044|56661555|56664973|56668405|56681954|56681955,103217856|134434452|134438317|134442153|134442154|134445998|134457609|134461397|134461398|175265278,4988,,P35372,Curation Efforts|Research and Development,21866885,0,,P35372,9606,197.0,,,1,1,1,1,0,0
583,621383,Literature-derived,Binding affinity to human MOP receptor at 10 uM by radioligand binding assay,"Title: Discovery of BI 99179, a potent and selective inhibitor of type I fatty acid synthase with central exposure._||_Abstract: Based on a high-throughput screen, cyclopentanecarboxanilides were identified as a new chemotype of non-covalent inhibitors of type I fatty acid synthase (FAS). Starting from initial hits we aimed at generating a tool compound suitable for the in vivo validation of FAS as a therapeutic target. Optimisation yielded BI 99179 which is characterised by high potency, remarkably high selectivity and significant exposure (both peripheral and central) upon oral administration in rats.",43,ChEMBL,CHEMBL1839775,20180919,51346964,134461578,4988,,P35372,Curation Efforts|Research and Development,21873051,0,,P35372,9606,,,,0,0,0,0,0,0
584,621455,Literature-derived,Binding affinity to human recombinant mu opioid receptor at 10 uM by radioligand displacement assay,"Title: Discovery of potent and novel S-nitrosoglutathione reductase inhibitors devoid of cytochrome P450 activities._||_Abstract: The pyrrole based N6022 was recently identified as a potent, selective, reversible, and efficacious S-nitrosoglutathione reductase (GSNOR) inhibitor and is currently undergoing clinical development for the treatment of acute asthma. GSNOR is a member of the alcohol dehydrogenase family (ADH) and regulates the levels of S-nitrosothiols (SNOs) through catabolism of S-nitrosoglutathione (GSNO). Reduced levels of GSNO, as well as other nitrosothiols (SNOs), have been implicated in the pathogenesis of many diseases including those of the respiratory, cardiovascular, and gastrointestinal systems. Preservation of endogenous SNOs through GSNOR inhibition presents a novel therapeutic approach with broad applicability. We describe here the synthesis and structure-activity relationships (SAR) of novel pyrrole based analogues of N6022 focusing on removal of cytochrome P450 inhibition activities. We identified potent and novel GSNOR inhibitors having reduced CYP inhibition activities and demonstrated efficacy in a mouse ovalbumin (OVA) model of asthma.",43,ChEMBL,CHEMBL1837226,20180919,46174418,134435412,4988,,P35372,Curation Efforts|Research and Development,21855338,0,,P35372,9606,,,,0,0,0,0,0,0
