,aid,aidtype,aidname,aiddesc,aidsrcid,aidsrcname,aidextid,aidmdate,cids,sids,geneids,aidcategories,protacxns,depcatg,pmids,rnai,ecs,repacxns,taxids,cellids,targettaxid,annotation,partial_agonist_desc,partial_agonist_aidname,agonist_desc,agonist_aidname,antagonist_desc,antagonist_aidname
1041,148758,Literature-derived,Compound was evaluated for the percent recovery of 0.5 nM of [3H]- bremazocine binding to total opioid receptor in unwashed guinea pig brain membranes at 50 (nM) concentration of the compound,"Title: Electrophilic opioid ligands. Oxygen tethered alpha-methylene-gamma-lactone, acrylate, isothiocyanate, and epoxide derivatives of 6 beta-naltrexol._||_Abstract: O6-Ether derivatives of 6 beta-naltrexol in which the ether substituent includes various electrophilic groups have been synthesized in an effort to examine structure-activity requirements at the 6 beta-substituent for receptor affinity and irreversibility of binding in opioid receptor preparations. A series of tethered 6 beta-ethers having terminal epoxides, alpha-methylene-gamma-lactones, and an isothiocyanate group were prepared. The stereochemistry of the alpha-methylene-gamma-lactones was established by convergent synthesis of their reduction products from epoxides of known absolute stereochemistry. In general, the tested compounds showed comparable affinity and selectivity for the receptor subtypes. All were found with high affinity for mu-sites. The terminal epoxide ether diastereomers 8 and 9 were not bound irreversibly in the assay for total opioid receptors. The alpha-methylene-gamma-lactone diastereomers 10 and 11, and their O14-acetyl precursors 20 and 21, respectively, varied in their irreversible effects, but where noted these effects were mu-site selective. Methacrylate ether 7 and isothiocyanate ether 12 were bound irreversibly at both mu- and delta-sites.",43,ChEMBL,CHEMBL750269,20200628,15663406|15663417,103278859|103278972,4985|4986|4988,,P35372|P41143|P41145,Curation Efforts|Research and Development,1320121,0,,P35372|P41143|P41145,10141,,,,0,0,0,0,0,0
1042,148760,Literature-derived,Compound was evaluated for the percent recovery of 0.5 nM of [3H]- bremazocine binding to total opioid receptor in washed guinea pig brain membranes at 50 (nM) concentration of the compound,"Title: Electrophilic opioid ligands. Oxygen tethered alpha-methylene-gamma-lactone, acrylate, isothiocyanate, and epoxide derivatives of 6 beta-naltrexol._||_Abstract: O6-Ether derivatives of 6 beta-naltrexol in which the ether substituent includes various electrophilic groups have been synthesized in an effort to examine structure-activity requirements at the 6 beta-substituent for receptor affinity and irreversibility of binding in opioid receptor preparations. A series of tethered 6 beta-ethers having terminal epoxides, alpha-methylene-gamma-lactones, and an isothiocyanate group were prepared. The stereochemistry of the alpha-methylene-gamma-lactones was established by convergent synthesis of their reduction products from epoxides of known absolute stereochemistry. In general, the tested compounds showed comparable affinity and selectivity for the receptor subtypes. All were found with high affinity for mu-sites. The terminal epoxide ether diastereomers 8 and 9 were not bound irreversibly in the assay for total opioid receptors. The alpha-methylene-gamma-lactone diastereomers 10 and 11, and their O14-acetyl precursors 20 and 21, respectively, varied in their irreversible effects, but where noted these effects were mu-site selective. Methacrylate ether 7 and isothiocyanate ether 12 were bound irreversibly at both mu- and delta-sites.",43,ChEMBL,CHEMBL750271,20200628,15663406|15663417,103278859|103278972,4985|4986|4988,,P35372|P41143|P41145,Curation Efforts|Research and Development,1320121,0,,P35372|P41143|P41145,10141,,,,0,0,0,0,0,0
1043,148762,Literature-derived,Compound was evaluated for the percent recovery of 0.5 nM of [3H]- bremazocine binding to total opioid receptors in guinea pig brain membranes at 50 (nM) concentration protection by 1 uM Naloxone.,"Title: Electrophilic opioid ligands. Oxygen tethered alpha-methylene-gamma-lactone, acrylate, isothiocyanate, and epoxide derivatives of 6 beta-naltrexol._||_Abstract: O6-Ether derivatives of 6 beta-naltrexol in which the ether substituent includes various electrophilic groups have been synthesized in an effort to examine structure-activity requirements at the 6 beta-substituent for receptor affinity and irreversibility of binding in opioid receptor preparations. A series of tethered 6 beta-ethers having terminal epoxides, alpha-methylene-gamma-lactones, and an isothiocyanate group were prepared. The stereochemistry of the alpha-methylene-gamma-lactones was established by convergent synthesis of their reduction products from epoxides of known absolute stereochemistry. In general, the tested compounds showed comparable affinity and selectivity for the receptor subtypes. All were found with high affinity for mu-sites. The terminal epoxide ether diastereomers 8 and 9 were not bound irreversibly in the assay for total opioid receptors. The alpha-methylene-gamma-lactone diastereomers 10 and 11, and their O14-acetyl precursors 20 and 21, respectively, varied in their irreversible effects, but where noted these effects were mu-site selective. Methacrylate ether 7 and isothiocyanate ether 12 were bound irreversibly at both mu- and delta-sites.",43,ChEMBL,CHEMBL750423,20200628,15663405,103278739,4985|4986|4988,,P35372|P41143|P41145,Curation Efforts|Research and Development,1320121,0,,P35372|P41143|P41145,10141,,,,0,0,0,0,0,0
1044,148764,Literature-derived,Opioid activity in terms of inhibition of [3H]dihydromorphine binding to opioid receptor mu in rat brain membrane.,"Title: Electrophilic opioid ligands. Oxygen tethered alpha-methylene-gamma-lactone, acrylate, isothiocyanate, and epoxide derivatives of 6 beta-naltrexol._||_Abstract: O6-Ether derivatives of 6 beta-naltrexol in which the ether substituent includes various electrophilic groups have been synthesized in an effort to examine structure-activity requirements at the 6 beta-substituent for receptor affinity and irreversibility of binding in opioid receptor preparations. A series of tethered 6 beta-ethers having terminal epoxides, alpha-methylene-gamma-lactones, and an isothiocyanate group were prepared. The stereochemistry of the alpha-methylene-gamma-lactones was established by convergent synthesis of their reduction products from epoxides of known absolute stereochemistry. In general, the tested compounds showed comparable affinity and selectivity for the receptor subtypes. All were found with high affinity for mu-sites. The terminal epoxide ether diastereomers 8 and 9 were not bound irreversibly in the assay for total opioid receptors. The alpha-methylene-gamma-lactone diastereomers 10 and 11, and their O14-acetyl precursors 20 and 21, respectively, varied in their irreversible effects, but where noted these effects were mu-site selective. Methacrylate ether 7 and isothiocyanate ether 12 were bound irreversibly at both mu- and delta-sites.",43,ChEMBL,CHEMBL752104,20200628,15663405|15663419,103278739|103279100,4985|4986|4988,,P35372|P41143|P41145,Curation Efforts|Research and Development,1320121,0,,P35372|P41143|P41145,10141,,,,0,0,0,0,0,0
1045,148766,Literature-derived,In vitro inhibitory activity against opioid activity in guinea pig ileum relative to morphine,"Title: Synthesis and opioid activity of dermorphin tetrapeptides bearing D-methionine S-oxide at position 2._||_Abstract: Eight new dermorphin tetrapeptides, X-Tyr-D-MetO-Phe-aa-Y (X = H, H2N = C(NH); aa = Gly, 2-aminoethanol, sarcosine; Y = NH2, NH-alkyl), were prepared and tested for opioid activity. They show dose-related naloxone-reversible opioid effects in vitro and in vivo. H-Tyr-D-MetO-Phe-Gly-NH2 (I) (guinea pig ileum IC50 = 13.6 nM; tail-flick ED50 = 1.97 pmol/mouse, icv, and 0.65 mumol/kg, sc), though less effective in the periphery, has central activities higher than those of dermorphin H-Tyr-D-Ala-Phe-Gly-Tyr-Pro-Ser-NH2. Following intracerebroventricular or subcutaneous administrations in mice, I is about respectively 1500 and 17 times as potent an analgesic as morphine.",43,ChEMBL,CHEMBL752106,20200628,44382891|44382892|44382893,103429404|103429405|103429406,4985|4986|4988,In vitro,P35372|P41143|P41145,Curation Efforts|Research and Development,2872334,0,,P35372|P41143|P41145,10141,,,,0,0,0,0,0,0
1057,150418,Literature-derived,Inhibitory activity against non-selective opiate receptor; NA=Not active,Title: Synthesis and binding affinity of neuropeptide Y at opiate receptors._||_Abstract: Neuropeptide Y and several metabolic fragments were synthesized and evaluated for binding affinity at non-selective opiate receptors. Neuropeptide Y and several C-terminal fragments were shown to bind to non-selective opiate receptors with an affinity similar to that of Leu-enkephalin.,43,ChEMBL,CHEMBL756579,20181001,44265121,103166807,4988,,P35372,Curation Efforts|Research and Development,12643904,0,,P35372,,,,,0,0,0,0,0,0
1058,150420,Literature-derived,Binding affinity towards non-selective opiate receptor; NA=Not active,Title: Synthesis and binding affinity of neuropeptide Y at opiate receptors._||_Abstract: Neuropeptide Y and several metabolic fragments were synthesized and evaluated for binding affinity at non-selective opiate receptors. Neuropeptide Y and several C-terminal fragments were shown to bind to non-selective opiate receptors with an affinity similar to that of Leu-enkephalin.,43,ChEMBL,CHEMBL756581,20181001,44265111|44265121,103166786|103166807,4988,,P35372,Curation Efforts|Research and Development,12643904,0,,P35372,,,,,0,0,0,0,0,0
1067,150834,Confirmatory,Antagonistic activity against recombinant human Opioid receptor mu 1<br>expressed in CHO cells when incubated with DAMGO,"Title: Synthesis and biological evaluation of 14-alkoxymorphinans. 21. Novel 4-alkoxy and 14-phenylpropoxy derivatives of the mu opioid receptor antagonist cyprodime._||_Abstract: The synthesis, biological, and pharmacological evaluation of novel derivatives of cyprodime are described. Their binding affinities at mu, delta, and kappa opioid receptors were evaluated using receptor binding assay. It was observed that the affinity of these compounds was sensitive to the character and length of the substituent in position 4. Further prolongation of the 4-alkoxy group of cyprodime (1) and its 4-butoxy analogue 2 is detrimental for the mu opioid receptor affinity. Introduction of an arylalkoxy group at C-4 does not increase mu affinity in the case of benzyloxy, while a phenylpropoxy group reduces mu affinity. The delta and kappa affinities were also reduced compared to the reference compounds. A significant increase in the affinity at the mu opioid receptors was achieved by introducing a 14-phenylpropoxy group. Increases in the affinity at delta and kappa receptors were also observed. These findings provide further evidence that the nature of the substituent at position 14 has a major impact on the abilities of morphinans to interact with opioid receptors. In the [(35)S]GTPgammaS binding assay, all tested compounds were partial agonists at mu and delta receptors. Compounds 8 and 17 showed antagonism at kappa receptors, while compound 7 exhibited some partial agonist activity at this receptor. The novel derivatives of cyprodime containing a 14-phenylpropoxy group acted as potent antinociceptives. When tested in vivo, compounds 7, 8, and 17 were considerably more potent than morphine, with phenol 7 showing the highest antinociceptive potency (21-fold in the hot plate test, 38-fold in the tail flick test, and 300-fold in the paraphenylquinone writhing test) in mice. Introduction of a 14-phenylpropoxy substituent leads to a profound alteration in the pharmacological profile of this class of compounds.",43,ChEMBL,CHEMBL754574,20181017,5748293|44339472,103332294|103332565,4988,,P35372,Curation Efforts|Research and Development,15163203,0,,P35372,,197.0,,,1,0,1,1,1,1
1068,150836,Literature-derived,Antagonistic activity against recombinant human Opioid receptor mu 1 expressed in CHO cells when incubated with DAMGO;NT = Not Tested,"Title: Synthesis and biological evaluation of 14-alkoxymorphinans. 21. Novel 4-alkoxy and 14-phenylpropoxy derivatives of the mu opioid receptor antagonist cyprodime._||_Abstract: The synthesis, biological, and pharmacological evaluation of novel derivatives of cyprodime are described. Their binding affinities at mu, delta, and kappa opioid receptors were evaluated using receptor binding assay. It was observed that the affinity of these compounds was sensitive to the character and length of the substituent in position 4. Further prolongation of the 4-alkoxy group of cyprodime (1) and its 4-butoxy analogue 2 is detrimental for the mu opioid receptor affinity. Introduction of an arylalkoxy group at C-4 does not increase mu affinity in the case of benzyloxy, while a phenylpropoxy group reduces mu affinity. The delta and kappa affinities were also reduced compared to the reference compounds. A significant increase in the affinity at the mu opioid receptors was achieved by introducing a 14-phenylpropoxy group. Increases in the affinity at delta and kappa receptors were also observed. These findings provide further evidence that the nature of the substituent at position 14 has a major impact on the abilities of morphinans to interact with opioid receptors. In the [(35)S]GTPgammaS binding assay, all tested compounds were partial agonists at mu and delta receptors. Compounds 8 and 17 showed antagonism at kappa receptors, while compound 7 exhibited some partial agonist activity at this receptor. The novel derivatives of cyprodime containing a 14-phenylpropoxy group acted as potent antinociceptives. When tested in vivo, compounds 7, 8, and 17 were considerably more potent than morphine, with phenol 7 showing the highest antinociceptive potency (21-fold in the hot plate test, 38-fold in the tail flick test, and 300-fold in the paraphenylquinone writhing test) in mice. Introduction of a 14-phenylpropoxy substituent leads to a profound alteration in the pharmacological profile of this class of compounds.",43,ChEMBL,CHEMBL754576,20181017,44339409,103332388,4988,,P35372,Curation Efforts|Research and Development,15163203,0,,P35372,,197.0,,,1,0,1,1,1,1
1069,150838,Confirmatory,"Antagonistic activity against human cloned delta opioid receptor using DAMGO in [35S]GTP-gamma-S, assay","Title: Identification of (3R)-7-hydroxy-N-((1S)-1-[[(3R,4R)-4-(3-hydroxyphenyl)- 3,4-dimethyl-1-piperidinyl]methyl]-2-methylpropyl)-1,2,3,4-tetrahydro- 3-isoquinolinecarboxamide as a novel potent and selective opioid kappa receptor antagonist._||_Abstract: (3R)-7-Hydroxy-N-((1S)-1-[[(3R,4R)-4-(3-hydroxyphenyl)-3,4-dimethyl-1-piperidinyl]methyl]-2-methylpropyl)-1,2,3,4-tetrahydro-3-isoquinolinecarboxamide (JDTic) was identified as a potent and selective kappa opioid receptor antagonist. Structure-activity relationship (SAR) studies on JDTic analogues revealed that the 3R,4R stereochemistry of the 3,4-dimethyl-4-(3-hydroxyphenyl)piperidine core structure, the 3R attachment of the 7-hydroxy-1,2,3,4-tetrahydroisoquinoline group, and the 1S configuration of the 2-methylpropyl (isopropyl) group were all important to its kappa potency and selectivity. The results suggest that, like other kappa opioid antagonists such as nor-BNI and GNTI, JDTic requires a second basic amino group to express potent and selective kappa antagonist activity in the [(35)S]GTPgammaS functional assay. However, unlike previously reported kappa antagonists, JDTic also requires a second phenol group in rigid proximity to this second basic amino group. The potent and selective kappa antagonist properties of JDTic can be rationalized using the 'message-address' concept wherein the (3R,4R)-3,4-dimethyl-4-(hydroxyphenyl)piperidinyl group represents the message, and the basic amino and phenol group in the N substituent constitutes the address. It is interesting to note the structural commonality (an amino and phenol groups) in both the message and address components of JDTic. The unique structural features of JDTic will make this compound highly useful in further characterization of the kappa receptor.",43,ChEMBL,CHEMBL754373,20181017,11070421,163336637,4988,,P35372,Curation Efforts|Research and Development,12825951,0,,P35372,,,,,0,0,1,1,1,1
1070,150840,Confirmatory,The antagonistic activity tested in [35S]-GTP-gamma S Recombinant Human Opioid receptor mu 1 transfected in to CHO cells for the displacement of [3H]DAMGO (mu),Title: 4'-Arylpyrrolomorphinans: effect of a pyrrolo-N-benzyl substituent in enhancing delta-opioid antagonist activity._||_Abstract: A new method for the preparation of N-benzylpyrrolomorphinans has been developed. Thus Michael reaction of the benzylimines of oxycodones and oxymorphones with nitrostyrenes gave a series of 4'-aryl-N-benzylpyrrolomorphinans. These were selective delta antagonists of much higher in vitro potency (with 5a having K(e) delta = <1 nM) than their binding affinities predicted. In mice in vivo assays 5a showed good delta antagonist activity in the anti-writhing analgesic assay and also inhibited delta agonist-induced convulsant activity.,43,ChEMBL,CHEMBL754375,20181017,5497186|44367136|44367182|44367308|44367339,103397313|103397470|103397822|103397897|103697951,4988,,P35372,Curation Efforts|Research and Development,11784158,0,,P35372,,197.0,,,0,0,1,1,1,1
1072,150844,Literature-derived,Displacement of [3H]DAMGO (2 nM ) from opioid receptor mu 1 in human brain; nd indicates not determined,"Title: Fentanyl derivatives bearing aliphatic alkaneguanidinium moieties: a new series of hybrid molecules with significant binding affinity for mu-opioid receptors and I2-imidazoline binding sites._||_Abstract: A new series of fentanyl derivatives [i.e., N-[1-(2-phenethyl)-4-piperidyl]-N-(guanidinoalkyl)propanamide] bearing aliphatic alkaneguanidinium moieties were prepared. Their affinities for the micro opioid receptors and for the I(2)-imidazoline binding sites (I(2)-IBS) were determined on human post-mortem prefrontal cortex membranes. All of these hybrid compounds had significant and/or very high affinity for both receptors in the nanomolar range, meaning an improvement compared to the prototype N-[1-(2-phenethyl)-4-piperidyl]-N-(guanidinopropyl)propanamide previously reported.",43,ChEMBL,CHEMBL751573,20181001,54459,103169925,4988,,P35372,Curation Efforts|Research and Development,14698188,0,,P35372,9606,,,,0,0,0,0,0,0
1076,150852,Confirmatory,Binding affinity for human Opioid receptor mu 1 transfected into chinese hamster ovary cells by displacing [3H]DAMGO radioligand,"Title: Opioid binding and in vitro profiles of a series of 4-hdroxy-3-methoxyindolomorphinans. Transformation of a delta-selective ligand into a high affinity kappa-selective ligand by introduction of a 5,14-substituted bridge._||_Abstract: In investigation of the effects of 14-substitution in the indolomorphinan series of delta-selective opioid ligands, 5,14-bridged indolomorphinans (4) were prepared from the equivalent dihydrothebainone acid-catalyzed rearrangement products of the dihydrothevinols. Though the new ligands generally had low affinity for opioid receptors and no delta-selectivity, 4b had high kappa-affinity and substantial selectivity which was also seen in the precursor morphinanone (3b). This indicates that the methylbenzylidene-substituted bridge in these compounds is a dominant kappa-opioid receptor binding motif.",43,ChEMBL,CHEMBL751581,20181017,5360515|5497186|10074239|44337613|44337642|44337645|44337683|44337789|44337800|44337839,103328370|103328441|103328446|103328480|103328513|103328741|103328773|103328852|103697951|131283791,4988,,P35372,Curation Efforts|Research and Development,12825957,0,,P35372,9606,,,,0,0,0,0,0,0
1077,150854,Literature-derived,Binding affinity at human Opioid receptor mu 1 was determined by using [3H]diprenorphine radioligand in CHO cell membranes at a concentration of 0.12 nM; ND means no data,Title: Synthesis and structure-activity relationships of aminoalkylazetidines as ORL1 receptor ligands._||_Abstract: A series of aminoalkylazetidines has been discovered as novel ORL1 receptor ligands. Structure-activity relationships have been investigated at the azetidine N and the alkyl side chain sites. Several potent and selective analogues have been identified.,43,ChEMBL,CHEMBL750008,20180930,44336906|44337130|44337461,103326790|103327323|103328038,4988,,P35372,Curation Efforts|Research and Development,12372523,0,,P35372,,197.0,,,0,0,0,0,0,0
1086,150990,Confirmatory,"Inhibition of binding of the non-selective opioid antagonist, [3H]diprenorphine, to cloned human mu opioid receptor","Title: trans-3,4-dimethyl-4-(3-carboxamidophenyl)piperidines: a novel class of micro-selective opioid antagonists._||_Abstract: trans-3,4-Dimethyl-4-(3-carboxamidophenyl)piperidines constitute a novel class of micro opioid receptor antagonists. The CONH(2) group was found to be an effective isostere of the phenolic OH moiety. Structure-activity relationships at the piperidine nitrogen position led to the identification of several ligands displaying high affinity toward the cloned human micro opioid receptors, good selectivity micro/delta, micro/kappa, and potent in vitro antagonist activity.",43,ChEMBL,CHEMBL753397,20181001,134131|5284596|10449693|44358749|44358751|44358763|44358764|44358829|44358857|44358875|44358880|44358889|44358890|44358892|44358901|44358904|44358922|44358923|44358924|44358967|44358968|44358969|44358987|44359130|44359131|44359139|44359140,103170037|103310529|103377008|103377009|103377035|103377037|103377180|103377247|103377276|103377285|103377306|103377307|103377309|103377340|103377361|103377387|103377389|103377390|103377490|103377491|103377492|103377526|103377593|103377887|103377889|103377924|103377925,4988,,P35372,Curation Efforts|Research and Development,14643346,0,,P35372,,,,,0,0,1,1,1,1
1087,150992,Confirmatory,In vitro potency was measured against human Opioid receptor mu 1,"Title: Synthesis and biological activity of a novel methylamine-bridged enkephalin analogue (MABE): a new route to cyclic peptides and peptidomimetics._||_Abstract: The synthesis and biological activity of a methylamine-bridged enkephalin analogue (MABE) is presented. The key step in the synthesis of the target compound involves the ring opening of Cbz-d-serine beta-lactone with Boc-Phe-NHCH2CH2NHCH3. Further synthetic elaboration of the resulting building block yielded compound 1 (MABE, Tyr-c[(NbetaCH3)-D-A2pr-Gly-Phe-NHCH2CH2-], where A2pr is a 2,3-diaminopropionic acid residue). Utilizing a combination of NMR and molecular modeling, the structure-biological activity relationships for compound 1 were studied. Using an in vitro isolated receptor assay, MABE was found to have affinities for isolated mu delta, and kappa opioid receptors of 1.6, 2.1, and 340 nM, respectively. By an in vivo thermal escape assay, MABE was found to have an ED50 of 0.027 microg in the rat when administered intrathecally. This effect was reversed by naloxone. By comparison, DAMGO, morphine, and DPDPE were found to yield ED50 values of 0.14, 2.4, and 54 microg, respectively, in the same assay.",43,ChEMBL,CHEMBL753399,20181015,5288826|5462471|10720494|44299404,103169185|103217856|103243877|103296233,4988,In vitro,P35372,Curation Efforts|Research and Development,9651168,0,,P35372,,,,,0,0,0,0,0,0
1089,150996,Confirmatory,Inhibition of binding of [3H]diprenorphine to cloned human Opioid receptor mu 1 expressed in CHO cell membrane;Range is in between (1.3-3.7),"Title: Synthesis and biological activities of cyclic lanthionine enkephalin analogues: delta-opioid receptor selective ligands._||_Abstract: The synthesis and biological test results of a series of enkephalin analogues incorporating the lanthionine modification are presented. The syntheses of four monosulfide-bridged analogues of enkephalins, Tyr-c[D-Ala(L)-Gly-Phe-D-Ala(L)]-OH (1a), Tyr-c[D-Val(L)-Gly-Phe-D-Ala(L)]-OH (1b), Tyr-c[D-Ala(L)-Gly-Phe-Ala(L)]-OH (1c), and Tyr-c[D-Val(L)-Gly-Phe-Ala(L)]-OH (1d), where Ala(L) and Val(L) denote the lanthionine amino acid ends linked by a monosulfide bridge to form the lanthionine structure, were successfully carried out via preparation of the linear peptide on solid support and cyclization in solution. In vitro binding assays against mu-, delta-, and kappa-opioid receptors and in vitro tests using GPI and MVD assays revealed that the dimethyl lanthionine analogues 1b and 1d, denoted as D-Val(L) in position 2, show substantial selectivity toward the delta-opioid receptor, while the unsubstituted analogues 1a and 1c, denoted as D-Ala(L) in position 2, bind to both mu- and delta-opioid receptors. The in vivo thermal escape assay by intrathecal administration showed that the analogues 1b and 1d are among the most potent ligands at producing antinociception through the delta-opioid receptor. The picomolar potencies of analogues 1a and 1c in the intrathecal (it.) assay strongly indicate that mu- and delta-opioid receptors interact synergistically to modulate the antinociceptive responses.",43,ChEMBL,CHEMBL753402,20181017,11071778,103352848,4988,,P35372,Curation Efforts|Research and Development,12166947,0,,P35372,,197.0,,,0,0,0,0,0,0
