,aid,aidtype,aidname,aiddesc,aidsrcid,aidsrcname,aidextid,aidmdate,cids,sids,geneids,aidcategories,protacxns,depcatg,pmids,rnai,ecs,repacxns,taxids,cellids,targettaxid,annotation,partial_agonist_desc,partial_agonist_aidname,agonist_desc,agonist_aidname,antagonist_desc,antagonist_aidname
1482,600436,Literature-derived,Antagonist activity at human recombinant mu-type opioid receptor coupled Galphaqi5 chimeric protein expressed in CHO cell membranes assessed as inhibition of dermorphin-stimulated calcium mobilization,"Title: Structure-activity studies on the nociceptin/orphanin FQ receptor antagonist 1-benzyl-N-{3-[spiroisobenzofuran-1(3H),4'-piperidin-1-yl]propyl} pyrrolidine-2-carboxamide._||_Abstract: Twelve derivatives of the nociceptin/orphanin FQ (N/OFQ) receptor (NOP) antagonist 1-benzyl-N-{3-[spiroisobenzofuran-1(3H),4'-piperidin-1-yl]propyl} pyrrolidine-2-carboxamide (Comp 24) were synthesized and tested in binding experiments performed on CHO(hNOP) cell membranes. Among them, a novel interesting NOP receptor antagonist (compound 35) was identified by blending chemical moieties taken from different NOP receptor ligands. In vitro in various assays, Compound 35 consistently behaved as a pure, highly potent (pA(2) in the range 8.0-9.9), competitive and NOP selective antagonist. However compound 35 was found inactive when challenged against N/OFQ in vivo in the mouse tail withdrawal assay. Thus, the usefulness of the novel NOP ligand compound 35 is limited to in vitro investigations.",43,ChEMBL,CHEMBL1786451,20200629,5284596|25001412,103170037|131287188,4988,,P35372,Curation Efforts|Research and Development,19527931,0,,P35372,9606,197.0,,,0,0,1,1,1,1
1483,601050,Literature-derived,Inhibition of human recombinant MOP receptor at 10 uM by radioligand binding assay,"Title: Structure-activity relationships of pyrrole based S-nitrosoglutathione reductase inhibitors: pyrrole regioisomers and propionic acid replacement._||_Abstract: S-Nitrosoglutathione reductase (GSNOR) is a member of the alcohol dehydrogenase family (ADH) that regulates the levels of S-nitrosothiols (SNOs) through catabolism of S-nitrosoglutathione (GSNO). GSNO and SNOs are implicated in the pathogenesis of many diseases including those in respiratory, cardiovascular, and gastrointestinal systems. The pyrrole based N6022 was recently identified as a potent, selective, reversible, and efficacious GSNOR inhibitor which is currently undergoing clinical development. We describe here the synthesis and structure-activity relationships (SAR) of novel pyrrole based analogues of N6022 focusing on scaffold modification and propionic acid replacement. We identified equally potent and novel GSNOR inhibitors having pyrrole regioisomers as scaffolds using a structure based approach.",43,ChEMBL,CHEMBL1787428,20180919,44623946|46179378|46179476|46179566|46179568,124968684|131276881|131276883|131282916|131286938,4988,,P35372,Curation Efforts|Research and Development,21570838,0,,P35372,9606,,,,0,0,0,0,0,0
1484,603166,Confirmatory,Binding affinity to MOR-1 expressed in CHO cells after 90 mins,"Title: Generation of novel radiolabeled opiates through site-selective iodination._||_Abstract: Tritiated opioid radioligands have proven valuable in exploring opioid binding sites. However, tritium has many limitations. Its low specific activity and limited counting efficiency makes it difficult to examine low abundant, high affinity sites and its disposal is problematic due to the need to use organic scintillants and its relatively long half-life. To overcome these issues, we have synthesized both unlabeled and carrier-free radioiodinated iodobenzoyl derivatives of 6β-naltrexamine ((125)I-BNtxA, 18), 6β-naloxamine ((125)I-BNalA, 19) and 6β-oxymorphamine ((125)I-BOxyA, 20) with specific activities of 2100Ci/mmol. To optimize the utility of the radioligand, we designed a synthesis in which the radiolabel is incorporated in the last synthetic step, which required the selective iodination of the benzoyl moiety without incorporation into the phenolic A ring. Competition studies demonstrated high affinity of the unlabelled compounds for opioid receptors in transfected cell lines, as did the direct binding of the (125)I-ligands to the opioid receptors. The radioligand displayed very high sensitivity, enabling a marked reduction in tissue, as well as excellent signal/noise characteristics. These new (125)I-radioligands should prove valuable in future studies of opioid binding sites.",43,ChEMBL,CHEMBL1799269,20200629,56676715|56676716|56683383,134455997|134455998|134463631,4988,,P35372,Curation Efforts|Research and Development,21621410,0,,P35372,,197.0,,,0,0,0,0,0,0
1485,603170,Confirmatory,Displacement of [125I]-IBNalA from MOR-1 expressed in CHO cells,"Title: Generation of novel radiolabeled opiates through site-selective iodination._||_Abstract: Tritiated opioid radioligands have proven valuable in exploring opioid binding sites. However, tritium has many limitations. Its low specific activity and limited counting efficiency makes it difficult to examine low abundant, high affinity sites and its disposal is problematic due to the need to use organic scintillants and its relatively long half-life. To overcome these issues, we have synthesized both unlabeled and carrier-free radioiodinated iodobenzoyl derivatives of 6β-naltrexamine ((125)I-BNtxA, 18), 6β-naloxamine ((125)I-BNalA, 19) and 6β-oxymorphamine ((125)I-BOxyA, 20) with specific activities of 2100Ci/mmol. To optimize the utility of the radioligand, we designed a synthesis in which the radiolabel is incorporated in the last synthetic step, which required the selective iodination of the benzoyl moiety without incorporation into the phenolic A ring. Competition studies demonstrated high affinity of the unlabelled compounds for opioid receptors in transfected cell lines, as did the direct binding of the (125)I-ligands to the opioid receptors. The radioligand displayed very high sensitivity, enabling a marked reduction in tissue, as well as excellent signal/noise characteristics. These new (125)I-radioligands should prove valuable in future studies of opioid binding sites.",43,ChEMBL,CHEMBL1799273,20200629,5284596|5288826|5359371|5360515|5462471|10418702,103169185|103170037|103217856|123094338|131283791|134463632,4988,,P35372,Curation Efforts|Research and Development,21621410,0,,P35372,,197.0,,,0,0,0,0,0,0
1488,610904,Literature-derived,Binding affinity at human mu opioid receptor expressed in CHO-K1 cells at 10 uM,"Title: Benzyl derivatives with in vitro binding affinity for human opioid and cannabinoid receptors from the fungus Eurotium repens._||_Abstract: Bioassay-guided fractionation of the fungus Eurotium repens resulted in the isolation of two new benzyl derivatives, (E)-2-(hept-1-enyl)-3-(hydroxymethyl)-5-(3-methylbut-2-enyl)benzene-1,4-diol (1) and (E)-4-(hept-1-enyl)-7-(3-methylbut-2-enyl)-2,3-dihydrobenzofuran-2,5-diol (2), along with seven known compounds (3-9) including five benzaldehyde compounds, flavoglaucin (3), tetrahydroauroglaucin (4), dihydroauroglaucin (5), auroglaucin (6), and 2-(2',3-epoxy-1',3'- heptadienyl)-6-hydroxy-5-(3-methyl-2-butenyl)benzaldehyde (7), one diketopiperazine alkaloid, echinulin (8), and 5,7-dihydroxy-4-methylphthalide (9). The chemical structures of these compounds were established on the basis of extensive 1D and 2D NMR and HRMS data. Compounds 1-4 and 6 showed good binding affinity for human opioid or cannabinoid receptors. These findings have important implications for psychoactive studies with this class of compounds.",43,ChEMBL,CHEMBL1814853,20180919,104895|115252|119037|5284596|6434324|14355117|14503052|44559107|51340292|53388784|53388785,103170037|103558127|103579844|103685290|103694341|134438226|134445913|134449888|134453690|134457488|134459059,4988,,P35372,Curation Efforts|Research and Development,21667972,0,,P35372,9606,198.0,,,0,0,0,0,0,0
1490,612052,Confirmatory,Antagonist activity against human recombinant mu opioid receptor expressed in CHO cells assessed as inhibition of [35S]GTP-gamma-S binding after 3 hrs by liquid scintillation counting,"Title: Probes for narcotic receptor mediated phenomena. Part 42: synthesis and in vitro pharmacological characterization of the N-methyl and N-phenethyl analogues of the racemic ortho-c and para-c oxide-bridged phenylmorphans._||_Abstract: A new synthesis of N-methyl and N-phenethyl substituted ortho-c and para-c oxide-bridged phenylmorphans, using N-benzyl- rather than N-methyl-substituted intermediates, was used and the pharmacological properties of these compounds were determined. The N-phenethyl substituted ortho-c oxide-bridged phenylmorphan(rac-(3R,6aS,11aS)-2-phenethyl-2,3,4,5,6,11a-hexahydro-1H-3,6a-methanobenzofuro[2,3-c]azocin-10-ol (12)) was found to have the highest μ-opioid receptor affinity (K(i)=1.1 nM) of all of the a- through f-oxide-bridged phenylmorphans. Functional data ([³⁵S]GTP-γ-S) showed that the racemate 12 was more than three times more potent than naloxone as an μ-opioid antagonist.",43,ChEMBL,CHEMBL1816055,20200629,5284596|5480230|56678874,103170037|103698780|134457997,4988,,P35372,Curation Efforts|Research and Development,21570305,0,,P35372,9606,197.0,,,0,0,1,1,1,1
1495,619370,Literature-derived,Displacement of radioligand from opioid mu receptor assessed as 50% receptor inhibition at 10'-7 M,"Title: Synthesis and pharmacological evaluation of indole-based sigma receptor ligands._||_Abstract: A series of novel indole-based analogs were prepared and their affinities for sigma receptors were determined using in vitro radioligand binding assays. The results of this study identified several compounds with nanomolar sigma-2 affinity and significant selectivity over sigma-1 receptors. In particular, 2-(4-(3-(4-fluorophenyl)indol-1-yl)butyl)-6,7-dimethoxy-1,2,3,4-tetrahydroisoquinoline (9f) was found to display high affinity at sigma-2 receptors with good selectivity (σ-1/σ-2 = 395). The pharmacological binding profile for this compound was established with other relevant non-sigma sites.",43,ChEMBL,CHEMBL1833387,20200629,54753271,134452893,4988,,P35372,Curation Efforts|Research and Development,21899931,0,,P35372,,,,,0,0,0,0,0,0
1502,649258,Confirmatory,Displacement of [3H]DAMGO from human mu opioid receptor,"Title: SAR and biological evaluation of 3-azabicyclo[3.1.0]hexane derivatives as μ opioid ligands._||_Abstract: 3-Azabicyclo[3.1.0]hexane compounds were designed as novel achiral μ opioid receptor ligands for the treatment of pruritus in dogs. In this paper, we describe the SAR of this class of opioid ligand, highlighting changes to the lead structure which led to compounds having picomolar binding affinity, selective for the μ receptor over δ and κ subtypes. Some subtleties of functional activity will also be described.",43,ChEMBL,CHEMBL1958666,20200626,56673522|57345673|57400106|57401866,134452400|136932604|136939235|136942381,4988,,P35372,Curation Efforts|Research and Development,22357342,0,,P35372,9606,,,,0,0,0,0,0,0
1504,659110,Literature-derived,Displacement of [3H]DAMGO from human recombinant mu opioid receptor expressed in CHO cells at 10 uM after 2 hrs by liquid scintillation counting,"Title: Semisynthetic neoclerodanes as kappa opioid receptor probes._||_Abstract: Modification of the furan ring of salvinorin A (1), the main active component of Salvia divinorum, has resulted in novel neoclerodane diterpenes with opioid receptor affinity and activity. Conversion of the furan ring to an aldehyde at the C-12 position (5) has allowed for the synthesis of analogues with new carbon-carbon bonds at that position. Previous methods for forming these bonds, such as Grignard and Stille conditions, have met with limited success. We report a palladium catalyzed Liebeskind-Srogl cross-coupling reaction of a thioester and a boronic acid that occurs at neutral pH and ambient temperature to produce ketone analogs at C-12. To the best of our knowledge, this is the first reported usage of the Liebeskind-Srogl reaction to diversify a natural product scaffold. We also describe a one-step protocol for the conversion of 1 to 12-epi-1 (3) through microwave irradiation. Previously, this synthetically challenging process has required multiple steps. Additionally, we report in this study that alkene 9 and aromatic analogues 12, 19, 23, 25, and 26 were discovered to retain affinity and selectivity at kappa opioid receptors (KOP). Finally, we report that the furan-2-yl analog of 1 (31) has similar affinity to 1. Collectively, these findings suggest that different aromatic groups appended directly to the decalin core may be well tolerated by KOP receptors, and may generate further ligands with affinity and activity at KOP receptors.",43,ChEMBL,CHEMBL2026566,20180921,25242485|44581834|70681352|70683422|70683437|70685545|70687673|70687674|70693930,103630048|103630212|160667387|160672672|160672710|160678019|160683345|160683346|160699551,4988,,P35372,Curation Efforts|Research and Development,22464684,0,,P35372,9606,197.0,,,0,0,0,0,0,0
1505,661070,Literature-derived,Inhibition of mu opioid receptor at 10 uM,"Title: 7-Azabicyclo[2.2.1]heptane as a scaffold for the development of selective sigma-2 (σ2) receptor ligands._||_Abstract: A series of N-substituted 7-azabicyclo[2.2.1]heptanes (12-17 and 22-25) and similarly substituted pyrrolidines (32-36 and 41-44) were synthesized as sterically-reduced, achiral analogs of adamantane- and trishomocubane-derived σ ligands. In vitro competition binding assays against σ receptors revealed that arylalkyl N-substituents conferred selectivity for the σ(2) subtype, while alicyclic or polycarbocyclic substituents imparted high affinity for both subtypes. The σ(2) binding and subtype selectivities of N-arylalkyl-7-azanorbornanes was generally greater than the analogously-substituted pyrrolidines, indicating that steric bulk and conformational restriction around the nitrogen atom are likely important for subtype discrimination.",43,ChEMBL,CHEMBL2033936,20200627,199798|66561966|66561967,160667853|160667854|160673197,4988,,P35372,Curation Efforts|Research and Development,22607684,0,,P35372,,,,,0,0,0,0,0,0
1513,691014,Literature-derived,Inhibition of human mu opioid receptor at 10 uM by radioligand displacement assay,"Title: Discovery of a new molecular probe ML228: an activator of the hypoxia inducible factor (HIF) pathway._||_Abstract: Hypoxia and ischemia are linked to several serious public health problems that affect most major organ systems. Specific examples include diseases of the cardiovascular, pulmonary, renal, neurologic, and musculoskeletal systems. The most significant pathway for cellular response to hypoxia is the hypoxia inducible factor (HIF) pathway. HIFs are transcription factors responsible for the activation of genes which encode proteins that mediate adaptive responses to reduced oxygen availability. A high-throughput cell-based HIF-mediated gene reporter screen was carried out using the NIH's Molecular Libraries Small Molecule Repository to identify activators of the HIF pathway. This communication describes the subsequent medicinal chemistry optimization of a triazine scaffold that led to the identification of the new molecular probe ML228. A discussion of HIF activation SAR within this chemotype as well as detailed in vitro characterization of the probe molecule is presented here.",43,ChEMBL,CHEMBL2156226,20180923,2217157|2962284|3236125|34829688|44602318|46742353,163313191|163326076|163326086|163329511|163336959|163337321,4988,,P35372,Curation Efforts|Research and Development,22172704,0,,P35372,9606,,,,0,0,0,0,0,0
1515,695332,Confirmatory,Displacement of [3H]DAMGO from human recombinant mu-opioid receptor expressed in CHO cells after 60 mins by liquid scintillation assay,Title: Formylated polyamines as peptidomimetics._||_Abstract: A new construct for imitating a natural peptide ligand using a modified retro-inverso sequence is described. It is demonstrated through the synthesis of a peptidomimetic derived from the endogenous sequence of leucine enkephalin. The product was active at 400 nM and selective for μ-opioid receptors.,43,ChEMBL,CHEMBL2162310,20200625,71449570,163313473,4988,,P35372,Curation Efforts|Research and Development,23017884,0,,P35372,9606,197.0,,,0,0,0,0,0,0
1527,710398,Literature-derived,Inhibition of radioligand binding to MOP receptor at 10 uM,"Title: Identification of small molecule inhibitors of amyloid β-induced neuronal apoptosis acting through the imidazoline I(2) receptor._||_Abstract: Aberrant activation of signaling pathways plays a pivotal role in central nervous system disorders, such as Alzheimer's disease (AD). Using a combination of virtual screening and experimental testing, novel small molecule inhibitors of tPA-mediated extracellular signal-regulated kinase (Erk)1/2 activation were identified that provide higher levels of neuroprotection from Aβ-induced apoptosis than Memantine, the most recently FDA-approved drug for AD treatment. Subsequent target deconvolution efforts revealed that they all share low micromolar affinity for the imidazoline I(2) receptor, while being devoid of any significant affinity to a list of AD-relevant targets, including the N-methyl-d-aspartate receptor (NMDAR), acetylcholinesterase (AChE), and monoamine oxidase B (MAO-B). Targeting the imidazoline I(2) receptor emerges as a new mechanism of action to inhibit tPA-induced signaling in neurons for the treatment of AD and other neurodegenerative diseases.",43,ChEMBL,CHEMBL2183686,20200625,2760009|3158580|71455493,163324936|163328381|163331919,4988,,P35372,Curation Efforts|Research and Development,23098038,0,,P35372,,,,,0,0,0,0,0,0
1532,712684,Literature-derived,Displacement of [3H]DAMGO from mu-opioid receptor at 10 uM after 1.5 hrs by microbeta scintillation counting analysis,"Title: From α4β2 Nicotinic Ligands to the Discovery of σ1 Receptor Ligands: Pharmacophore Analysis and Rational Design._||_Abstract: Comparative analyses of the pharmacophoric elements required for σ1 and nicotinic ligands led to the identification of a potent and selective σ1 ligand (15). Compound 15 displayed high selectivity for the σ1 receptor (Ki, σ1 = 4.1 nM, Ki, σ2 = 1312 nM) with moderate binding affinity for the DAT (Ki = 373 nM) and NET (Ki = 203 nM) in the PDSP broad screening panel of common CNS neurotransmitter transporters and receptors. The key finding in this present work is that a subtle structural modifica tion could be used as a tool to switch a ligand's selectivity between nAChRs and sigma receptors.",43,ChEMBL,CHEMBL2210110,20200625,56949640|71452172,163313928|163318446,4988,,P35372,Curation Efforts|Research and Development,23641311,0,,P35372,,,,,0,0,0,0,0,0
1533,715236,Literature-derived,Displacement of [3H]DAMGO from human recombinant MOP receptor expressed in HEK293 cells at 10 uM after 120 mins,"Title: Discovery of a potent, orally bioavailable and highly selective human neuronal nitric oxide synthase (nNOS) inhibitor, N-(1-(piperidin-4-yl)indolin-5-yl)thiophene-2-carboximidamide as a pre-clinical development candidate for the treatment of migraine._||_Abstract: We recently reported a series of 1,6-disubstituted indoline-based thiophene amidine compounds (5) as selective neuronal nitric oxide synthase (nNOS) inhibitors to mitigate the cardiovascular liabilities associated with hERG K(+) channel inhibition (IC(50) = 4.7 μM) with previously reported tetrahydroquinoline-based selective nNOS inhibitors (4). The extended structure-activity relationship studies within the indoline core led to the identification of 43 as a selection candidate for further evaluations. The in vivo activity in two different pain (spinal nerve ligation and migraine pain) models, the excellent physicochemical and pharmacokinetic properties, oral bioavailability (F(po) = 91%), and the in vitro safety profile disclosed in this report make 43 an ideal candidate for further evaluation in clinical applications related to migraine pain.",43,ChEMBL,CHEMBL2209813,20200625,25014630,163315008,4988,,P35372,Curation Efforts|Research and Development,22840695,0,,P35372,9606,45.0,,,0,0,0,0,0,0
1539,727338,Confirmatory,Antagonist activity at human cloned MOR assessed as inhibition of DAMGO-stimulated [35S]GTPgammaS binding after 4 hrs by scintillation counting analysis,"Title: Development of κ opioid receptor antagonists._||_Abstract: κ opioid receptors (KORs) belong to the G-protein-coupled class of receptors (GPCRs). They are activated by the endogenous opioid peptide dynorphin (DYN) and expressed at particularly high levels within brain areas implicated in modulation of motivation, emotion, and cognitive function. Chronic activation of KORs in animal models has maladaptive effects including increases in behaviors that reflect depression, the propensity to engage in drug-seeking behavior, and drug craving. The fact that KOR activation has such a profound influence on behaviors often triggered by stress has led to interest in selective KOR antagonists as potential therapeutic agents. This Perspective provides a description of preclinical research conducted in the development of several different classes of selective KOR antagonists, a summary of the clinical studies conducted thus far, and recommendations for the type of work needed in the future to determine if these agents would be useful as pharmacotherapies for neuropsychiatric illness.",43,ChEMBL,CHEMBL2327126,20200626,44129648,136928384,4988,,P35372,Curation Efforts|Research and Development,23360448,0,,P35372,9606,,,,0,0,1,1,1,1
1541,729460,Literature-derived,Inhibition of human MOP receptor at 10 uM by radioligand binding assay,"Title: Development of dual PLD1/2 and PLD2 selective inhibitors from a common 1,3,8-Triazaspiro[4.5]decane Core: discovery of Ml298 and Ml299 that decrease invasive migration in U87-MG glioblastoma cells._||_Abstract: An iterative parallel synthesis effort identified a PLD2 selective inhibitor, ML298 (PLD1 IC50 > 20000 nM, PLD2 IC50 = 355 nM) and a dual PLD1/2 inhibitor, ML299 (PLD1 IC50 = 6 nM, PLD2 IC50 = 20 nM). SAR studies revealed that a small structural change (incorporation of a methyl group) increased PLD1 activity within this classically PLD2-preferring core and that the effect was enantiospecific. Both probes decreased invasive migration in U87-MG glioblastoma cells.",43,ChEMBL,CHEMBL2330320,20180926,53393916|71718136,164137381|164141690,4988,,P35372,Curation Efforts|Research and Development,23445448,0,,P35372,9606,,,,0,0,0,0,0,0
1550,739886,Confirmatory,Displacement of [3H]DAMGO from human mu opioid receptor expressed in CHO cell membrane after 60 mins by liquid scintillation counting,"Title: Redefining the structure-activity relationships of 2,6-methano-3-benzazocines. Part 9: Synthesis, characterization and molecular modeling of pyridinyl isosteres of N-BPE-8-CAC (1), a high affinity ligand for opioid receptors._||_Abstract: Derivatives of the lead compound N-BPE-8-CAC (1) where each CH of the biphenyl group was individually replaced by N were prepared in hopes of identifying high affinity ligands with improved aqueous solubility. Compared to 1, binding affinities of the five possible pyridinyl derivatives for the μ opioid receptor were between threefold lower to fivefold higher with the Ki of the most potent compound being 0.064 nM. Docking of 8-CAC (2) into the unliganded binding site of the mouse μ opioid receptor (pdb: 4DKL) revealed that 8-CAC and β-FNA (from 4DKL) make nearly identical interactions with the receptor. However, for 1 and the new pyridinyl derivatives 4-8, binding is not tolerated in the 8-CAC binding mode due to the steric constraints of the large N-substituents. Either an alternative binding mode or rearrangement of the protein to accommodate these modifications may account for their high binding affinity.",43,ChEMBL,CHEMBL2353047,20200626,44240971|44240972|44241022|57900041|57900045,164130025|164132872|164132873|164132874|164146846,4988,,P35372,Curation Efforts|Research and Development,23434225,0,,P35372,9606,197.0,,,0,0,0,0,0,0
1551,745766,Literature-derived,Displacement of [3H]-DAMGO from human mu opioid receptor transfected in CHOK1 cells at 10 uM after 60 mins relative to control,"Title: Neocosmospora sp.-derived resorcylic acid lactones with in vitro binding affinity for human opioid and cannabinoid receptors._||_Abstract: Bioassay-guided fractionation of a fungus Neocosmospora sp. (UM-031509) resulted in the isolation of three new resorcylic acid lactones, neocosmosin A (2), neocosmosin B (3), and neocosmosin C (4). Three known resorcylic acid lactones, monocillin IV (1), monocillin II (5), and radicicol (6), were also isolated and identified. The structures of these compounds were established on the basis of extensive 1D and 2D NMR spectroscopic analysis, mass spectrometric (ESIMS) data, and X-ray crystallography. Compounds 4-6 show good binding affinity for the human opioid receptors. These findings have important implications for evaluating the potential psychoactive effects with this class of compounds.",43,ChEMBL,CHEMBL2378219,20180926,104895|5275906|5284596|6323491|6478915|51693667|73351885|73356425,103170037|103582177|103599363|103685290|104234190|174505904|174511041|174521292,4988,,P35372,Curation Efforts|Research and Development,23659286,0,,P35372,9606,198.0,,,0,0,0,0,0,0
