aid,aidtype,aidname,aiddesc,aidsrcid,aidsrcname,aidextid,aidmdate,cids,sids,geneids,aidcategories,protacxns,depcatg,pmids,rnai,ecs,repacxns,taxids,cellids,targettaxid,annotation,partial_agonist_desc,partial_agonist_aidname,agonist_desc,agonist_aidname,antagonist_desc,antagonist_aidname
92953,Confirmatory,Compound was tested for binding affinity against human Ionotropic glutamate receptor AMPA 1 in HEK293 cells using [3H]-AMPA as radioligand,"Title: 4-Alkyl- and 4-cinnamylglutamic acid analogues are potent GluR5 kainate receptor agonists._||_Abstract: Enantiomerically pure (2S,4R)-4-substituted glutamic acids were prepared and tested for homomeric GluR5 and GluR6 kainate subtype receptor affinity. Some of the 4-cinnamyl analogues showed high selectivity and potency (K(i) < 25 nM) for the GluR5 receptors. The greatest selectivity and potency were achieved with the 3-(2-naphthyl)prop-2-enyl compound. This compound, LY339434, has negligible activity at the AMPA and kainate receptors GluR1, -2, -4 and -6. Although, LY339434 shows agonist activity at NMDA receptors in cultural hippocampal neurons (approximate EC(50) of 2.5 microM), we consider that LY339434 should be a useful pharmacological tool for the investigation of the functional role of GluR5 kainate receptors.",43,ChEMBL,CHEMBL701241,20181016,10255|33032|9861035|10541731,103174497|103248998|103249707|103699331,2890,,P42261,Curation Efforts|Research and Development,10821708,0,,P42261,,45.0,,,0,0,1,0,0,0
92959,Confirmatory,Binding affinity of compound was determined towards cloned Ionotropic glutamate receptor AMPA 1 (GluR1) expressed in Sf 9 insect cells,"Title: Design, synthesis, and pharmacology of a highly subtype-selective GluR1/2 agonist, (RS)-2-amino-3-(4-chloro-3-hydroxy-5-isoxazolyl)propionic acid (Cl-HIBO)._||_Abstract: On the basis of structural studies, chloro-homoibotenic acid (Cl-HIBO) was designed and synthesized. Cl-HIBO was characterized in binding and electrophysiology experiments on native and cloned subtypes of GluRs. Electrophysiological selectivities ranged from 275 to 1600 for GluR1/2 over GluR3/4. The potent AMPA receptor activity was strongly desensitizing and the neurotoxicity similar to AMPA. Thus, Cl-HIBO is the most subtype selective agonist reported to date on GluR1/2, and offers a new standard for selectively studying subtypes of AMPA receptors.",43,ChEMBL,CHEMBL701247,20181017,1221|2733518|4694356,103174429|103270115|103270154,2890,,P42261,Curation Efforts|Research and Development,12747796,0,,P42261,,,,,0,0,1,0,0,0
163311,Literature-derived,Percent decrease of Quisqualate receptor binding using AMPA,"Title: 7-Methyl-6,7,8,9,14,15-hexahydro-5H-benz[d]indolo[2,3-g]azecine: a new heterocyclic system and a new lead compound for dopamine receptor antagonists._||_Abstract: Partially hydrogenated derivatives of the new heterocyclic ring systems benz[d]indolo[2,3-g]azecine and bisindolo[3,2-d][2, 3-g]azecine were synthesized starting from lactones and amines via the described synthetic methods. In binding assays with rat striatal receptors, 7-methyl-6,7,8,9,14,15-hexahydro-5H-benz[d]indolo[2, 3-g]azecine (LE 300) proved to be of high affinity for the D(1) binding site (K(i) = 0.08 nmol for displacement of [(3)H]SCH23390), being superior in this assay to standards such as butaclamol and SCH23390. This compound was characterized as a dopamine antagonist by conditioned avoidance response test with mice. Thus, LE 300 represents the lead of a new class of dopamine antagonists for future investigations.",43,ChEMBL,CHEMBL764779,20181016,385013|386224|10503931|14934406,103257092|103257134|103257138|103257160,2890|2891|2892|2893,,P42261|P42262|P42263|P48058,Curation Efforts|Research and Development,10821720,0,,P42261|P42262|P42263|P48058,,,,,0,0,1,0,1,0
163313,Literature-derived,Inhibitory activity against Quisqualate receptor using [3H]AMPA at 10e5 (M),"Title: Novel selective and partial agonists of 5-HT3 receptors. Part 1. Synthesis and biological evaluation of piperazinopyrrolothienopyrazines._||_Abstract: A series of piperazinopyrrolo[1,2-a]thieno[3,2-e]- and -[2,3-e]pyrazine derivatives were prepared and evaluated in order to determine the necessary requirements for high affinity on the 5-HT3 receptors and high selectivity versus other 5-HT receptor subtypes. Various substitutions on the piperazine and the thiophene ring of the pyrrolothienopyrazine moieties were systematically explored as well as replacement of the piperazine by other cyclic amines. The best compounds are in the nanomolar range of affinity of 5-HT3 receptors with high to very high selectivity (up to 10,000 for 14b). These high-affinity compounds have in common a benzyl- or allylpiperazine substituent with no substitutions on the thiophene ring. Five of these compounds (1a, 4b, 13a,b, and 14b) have been evaluated on the Von Bezold-Jarisch reflex and were characterized as partial agonists. One of them, 13a, has shown in vivo at very low dose a potent anxiolytic-like activity in the light/dark test.",43,ChEMBL,CHEMBL766504,20181015,9863146,103237550,2890|2891|2892|2893,,P42261|P42262|P42263|P48058,Curation Efforts|Research and Development,8642566,0,,P42261|P42262|P42263|P48058,,,,,1,0,1,0,0,0
239015,Confirmatory,Binding affinity for ionotropic Glutamate receptor AMPA 1 expressed in Sf9 cells,"Title: Convergent synthesis and pharmacology of substituted tetrazolyl-2-amino-3-(3-hydroxy-5-methyl-4-isoxazolyl)propionic acid analogues._||_Abstract: The synthesis and pharmacological characterization of 1- and 2-alkyltetrazolyl analogues of (RS)-2-amino-3-[3-hydroxy-5-(2-methyl-2H-5-tetrazolyl)-4-isoxazolyl]propionic acid (2-Me-Tet-AMPA), a highly potent and selective agonist at AMPA receptors, are presented. A shorter and more convergent synthetic route than previously described, employing a new method for introducing the amino acid moiety, was developed for these derivatives. The 2-substituted isomers were selective agonists, and their activity correlated inversely with the size of the substituent. Structural explanations of the structure-activity relationship are provided.",43,ChEMBL,CHEMBL829619,20181018,158397|447081|11219775|11288627|11818375,103177538|103463284|103463359|103463611|103463743,2890,,P42261,Curation Efforts|Research and Development,15857151,0,,P42261,,521.0,,,0,0,1,0,0,0
257209,Literature-derived,Inhibitory effect on glutamate-induced calcium influx at homomeric human GLUA1 receptor expressed in HEK293 cells up to 300 uM,"Title: Synthesis and pharmacology of willardiine derivatives acting as antagonists of kainate receptors._||_Abstract: The natural product willardiine (8) is an AMPA receptor agonist while 5-iodowillardiine (10) is a selective kainate receptor agonist. In an attempt to produce antagonists of kainate and AMPA receptors analogues of willardiine with substituents at the N3 position of the uracil ring were synthesized. The N3-4-carboxybenzyl substituted analogue (38c) was found to be equipotent at AMPA and GLUK5-containing kainate receptors in the neonatal rat spinal cord. The N3-2-carboxybenzyl substituted analogue (38a) proved to be a potent and selective GLUK5 subunit containing kainate receptor antagonist when tested on native rat and human recombinant AMPA and kainate receptor subtypes. The GLUK5 kainate receptor antagonist activity was found to reside in the S enantiomer (44a) whereas the R enantiomer (44b) was almost inactive. 5-Iodo substitution of the uracil ring of 44a gave 45, which was found to have enhanced potency and selectivity for GLUK5.",43,ChEMBL,CHEMBL863279,20181019,11674376,103473689,2890,,P42261,Curation Efforts|Research and Development,16302825,0,,P42261,9606.0,45.0,,,0,0,1,0,1,0
258849,Literature-derived,Inhibition of AMPA receptor at 1 nM,"Title: 1-((S)-2-aminopropyl)-1H-indazol-6-ol: a potent peripherally acting 5-HT2 receptor agonist with ocular hypotensive activity._||_Abstract: Serotonin 5-HT(2) receptor agonists have been identified as a potential new class of agents for the treatment of ocular hypertension and glaucoma. The initially reported tryptamine analogues displayed either poor solution stability, potent central nervous system activity, or both of these undesirable characteristics and were unacceptable for clinical evaluation. A series of 1-(2-aminopropyl)-1H-indazole analogues was synthesized and evaluated for their suitability for consideration as clinical candidates. 1-((S)-2-Aminopropyl)-1H-indazol-6-ol (9) was identified as a peripherally acting potent 5-HT(2) receptor agonist (EC(50) = 42.7 nM, E(max) = 89%) with high selectivity for the 5-HT(2) receptors relative to other serotonergic receptor subtypes and other families of receptors and has significantly greater solution stability than alpha-methyl-5-hydroxytryptamine. Additionally, 9 potently lowers intraocular pressure in conscious ocular hypertensive monkeys (-13 mmHg, 33%); this reduction appears to be through a local rather than a centrally mediated effect. Compound 9 appears to be an excellent 5-HT(2) receptor agonist for conducting further studies directed toward a clinical proof-of-concept study for this class of ocular hypotensive agents.",43,ChEMBL,CHEMBL852990,20181020,135453290,103476625,2890|2891|2892|2893,,P42261|P42262|P42263|P48058,Curation Efforts|Research and Development,16392816,0,,P42261|P42262|P42263|P48058,,,,,0,0,1,0,0,0
258851,Literature-derived,Inhibition of AMPA receptor at 10 uM,"Title: 1-((S)-2-aminopropyl)-1H-indazol-6-ol: a potent peripherally acting 5-HT2 receptor agonist with ocular hypotensive activity._||_Abstract: Serotonin 5-HT(2) receptor agonists have been identified as a potential new class of agents for the treatment of ocular hypertension and glaucoma. The initially reported tryptamine analogues displayed either poor solution stability, potent central nervous system activity, or both of these undesirable characteristics and were unacceptable for clinical evaluation. A series of 1-(2-aminopropyl)-1H-indazole analogues was synthesized and evaluated for their suitability for consideration as clinical candidates. 1-((S)-2-Aminopropyl)-1H-indazol-6-ol (9) was identified as a peripherally acting potent 5-HT(2) receptor agonist (EC(50) = 42.7 nM, E(max) = 89%) with high selectivity for the 5-HT(2) receptors relative to other serotonergic receptor subtypes and other families of receptors and has significantly greater solution stability than alpha-methyl-5-hydroxytryptamine. Additionally, 9 potently lowers intraocular pressure in conscious ocular hypertensive monkeys (-13 mmHg, 33%); this reduction appears to be through a local rather than a centrally mediated effect. Compound 9 appears to be an excellent 5-HT(2) receptor agonist for conducting further studies directed toward a clinical proof-of-concept study for this class of ocular hypotensive agents.",43,ChEMBL,CHEMBL852992,20181020,135453290,103476625,2890|2891|2892|2893,,P42261|P42262|P42263|P48058,Curation Efforts|Research and Development,16392816,0,,P42261|P42262|P42263|P48058,,,,,0,0,1,0,0,0
263563,Confirmatory,Binding affinity to AMPA receptor by radioligand binding assay,"Title: Synthesis, in vitro and in vivo evaluation of [O-methyl-11C] 2-{4-[4-(3-methoxyphenyl)piperazin-1-yl]-butyl}-4-methyl-2H-[1,2,4]-triazine-3,5-dione: a novel agonist 5-HT1A receptor PET ligand._||_Abstract: Synthesis and in vivo evaluation of 2-{4-[4-(3-methoxyphenyl)piperazin-1-yl]-butyl}-4-methyl-2H-[1,2,4]triazine-3,5-dione (5 or MMT), a high affinity and selective serotonin 5-HT1AR agonist PET tracer, are described. GTPgammaS assay shows that MMT is an agonist with an EC50 comparable to 5-HT. Radiolabeling of 5 was achieved in 30% yield (EOS) from desmethyl-MMT (4) with >99% chemical and radiochemical purities and a specific activity >1000 Ci/mmol. PET studies in baboon show that [11C]5 penetrates the blood-brain barrier but, because of low specific binding and fast clearance of radioactivity it is not a suitable PET tracer for the in vivo quantification of 5-HT1AR.",43,ChEMBL,CHEMBL861228,20181020,11948707,103485024,2890|2891|2892|2893,,P42261|P42262|P42263|P48058,Curation Efforts|Research and Development,16458504,0,,P42261|P42262|P42263|P48058,,,,,0,0,1,0,0,0
297345,Confirmatory,Agonist activity at GluR1 expressed in HEK293 cells by Fluo-4/Ca2+ assay,"Title: Functional characterization of Tet-AMPA [tetrazolyl-2-amino-3-(3-hydroxy-5-methyl- 4-isoxazolyl)propionic acid] analogues at ionotropic glutamate receptors GluR1-GluR4. The molecular basis for the functional selectivity profile of 2-Bn-Tet-AMPA._||_Abstract: Four 2-substituted Tet-AMPA [Tet = tetrazolyl, AMPA = 2-amino-3-(3-hydroxy-5-methyl-4-isoxazolyl)propionic acid] analogues were characterized functionally at the homomeric AMPA receptors GluR1i, GluR2Qi, GluR3i, and GluR4i in a Fluo-4/Ca2+ assay. Whereas 2-Et-Tet-AMPA, 2-Pr-Tet-AMPA, and 2-iPr-Tet-AMPA were nonselective GluR agonists, 2-Bn-Tet-AMPA exhibited a 40-fold higher potency at GluR4i than at GluR1i. Examination of homology models of the S1-S2 domains of GluR1 and GluR4 containing 2-Bn-Tet-AMPA suggested four nonconserved residues in a region adjacent to the orthosteric site as possible determinants of the GluR4i/GluR1i selectivity. In a mutagenesis study, doubly mutating M686V/I687A in GluR1i in combination with either D399S or E683A increased both the potency and the maximal response of 2-Bn-Tet-AMPA at this receptor to levels similar to those elicited by the agonist at GluR4i. The dependence of the novel selectivity profile of 2-Bn-Tet-AMPA upon residues located outside of the orthosteric site underlines the potential for developing GluR subtype selective ligands by designing compounds with substituents that protrude beyond the (S)-Glu binding pocket.",43,ChEMBL,CHEMBL895662,20210302,33032|10658567|11219775|11288627|11818375|16659202,103309920|103463284|103463611|103463743|103516387|103699331,2890,,P42261,Curation Efforts|Research and Development,17672447,0,,P42261,,45.0,,,0,0,1,1,0,0
297353,Confirmatory,Agonist activity at GluR1 D399S mutant expressed in HEK293 cells by Fluo-4/Ca2+ assay,"Title: Functional characterization of Tet-AMPA [tetrazolyl-2-amino-3-(3-hydroxy-5-methyl- 4-isoxazolyl)propionic acid] analogues at ionotropic glutamate receptors GluR1-GluR4. The molecular basis for the functional selectivity profile of 2-Bn-Tet-AMPA._||_Abstract: Four 2-substituted Tet-AMPA [Tet = tetrazolyl, AMPA = 2-amino-3-(3-hydroxy-5-methyl-4-isoxazolyl)propionic acid] analogues were characterized functionally at the homomeric AMPA receptors GluR1i, GluR2Qi, GluR3i, and GluR4i in a Fluo-4/Ca2+ assay. Whereas 2-Et-Tet-AMPA, 2-Pr-Tet-AMPA, and 2-iPr-Tet-AMPA were nonselective GluR agonists, 2-Bn-Tet-AMPA exhibited a 40-fold higher potency at GluR4i than at GluR1i. Examination of homology models of the S1-S2 domains of GluR1 and GluR4 containing 2-Bn-Tet-AMPA suggested four nonconserved residues in a region adjacent to the orthosteric site as possible determinants of the GluR4i/GluR1i selectivity. In a mutagenesis study, doubly mutating M686V/I687A in GluR1i in combination with either D399S or E683A increased both the potency and the maximal response of 2-Bn-Tet-AMPA at this receptor to levels similar to those elicited by the agonist at GluR4i. The dependence of the novel selectivity profile of 2-Bn-Tet-AMPA upon residues located outside of the orthosteric site underlines the potential for developing GluR subtype selective ligands by designing compounds with substituents that protrude beyond the (S)-Glu binding pocket.",43,ChEMBL,CHEMBL895670,20210302,,,2890,,P42261,Curation Efforts|Research and Development,17672447,0,,P42261,9606.0,45.0,,,0,0,1,1,0,0
297355,Confirmatory,Agonist activity at GluR1 E683A mutant expressed in HEK293 cells by Fluo-4/Ca2+ assay,"Title: Functional characterization of Tet-AMPA [tetrazolyl-2-amino-3-(3-hydroxy-5-methyl- 4-isoxazolyl)propionic acid] analogues at ionotropic glutamate receptors GluR1-GluR4. The molecular basis for the functional selectivity profile of 2-Bn-Tet-AMPA._||_Abstract: Four 2-substituted Tet-AMPA [Tet = tetrazolyl, AMPA = 2-amino-3-(3-hydroxy-5-methyl-4-isoxazolyl)propionic acid] analogues were characterized functionally at the homomeric AMPA receptors GluR1i, GluR2Qi, GluR3i, and GluR4i in a Fluo-4/Ca2+ assay. Whereas 2-Et-Tet-AMPA, 2-Pr-Tet-AMPA, and 2-iPr-Tet-AMPA were nonselective GluR agonists, 2-Bn-Tet-AMPA exhibited a 40-fold higher potency at GluR4i than at GluR1i. Examination of homology models of the S1-S2 domains of GluR1 and GluR4 containing 2-Bn-Tet-AMPA suggested four nonconserved residues in a region adjacent to the orthosteric site as possible determinants of the GluR4i/GluR1i selectivity. In a mutagenesis study, doubly mutating M686V/I687A in GluR1i in combination with either D399S or E683A increased both the potency and the maximal response of 2-Bn-Tet-AMPA at this receptor to levels similar to those elicited by the agonist at GluR4i. The dependence of the novel selectivity profile of 2-Bn-Tet-AMPA upon residues located outside of the orthosteric site underlines the potential for developing GluR subtype selective ligands by designing compounds with substituents that protrude beyond the (S)-Glu binding pocket.",43,ChEMBL,CHEMBL895672,20210302,,,2890,,P42261,Curation Efforts|Research and Development,17672447,0,,P42261,9606.0,45.0,,,0,0,1,1,0,0
297357,Confirmatory,Agonist activity at GluR1 M686V mutant expressed in HEK293 cells by Fluo-4/Ca2+ assay,"Title: Functional characterization of Tet-AMPA [tetrazolyl-2-amino-3-(3-hydroxy-5-methyl- 4-isoxazolyl)propionic acid] analogues at ionotropic glutamate receptors GluR1-GluR4. The molecular basis for the functional selectivity profile of 2-Bn-Tet-AMPA._||_Abstract: Four 2-substituted Tet-AMPA [Tet = tetrazolyl, AMPA = 2-amino-3-(3-hydroxy-5-methyl-4-isoxazolyl)propionic acid] analogues were characterized functionally at the homomeric AMPA receptors GluR1i, GluR2Qi, GluR3i, and GluR4i in a Fluo-4/Ca2+ assay. Whereas 2-Et-Tet-AMPA, 2-Pr-Tet-AMPA, and 2-iPr-Tet-AMPA were nonselective GluR agonists, 2-Bn-Tet-AMPA exhibited a 40-fold higher potency at GluR4i than at GluR1i. Examination of homology models of the S1-S2 domains of GluR1 and GluR4 containing 2-Bn-Tet-AMPA suggested four nonconserved residues in a region adjacent to the orthosteric site as possible determinants of the GluR4i/GluR1i selectivity. In a mutagenesis study, doubly mutating M686V/I687A in GluR1i in combination with either D399S or E683A increased both the potency and the maximal response of 2-Bn-Tet-AMPA at this receptor to levels similar to those elicited by the agonist at GluR4i. The dependence of the novel selectivity profile of 2-Bn-Tet-AMPA upon residues located outside of the orthosteric site underlines the potential for developing GluR subtype selective ligands by designing compounds with substituents that protrude beyond the (S)-Glu binding pocket.",43,ChEMBL,CHEMBL895674,20210302,,,2890,,P42261,Curation Efforts|Research and Development,17672447,0,,P42261,9606.0,45.0,,,0,0,1,1,0,0
297359,Confirmatory,Agonist activity at GluR1 I687A mutant expressed in HEK293 cells by Fluo-4/Ca2+ assay,"Title: Functional characterization of Tet-AMPA [tetrazolyl-2-amino-3-(3-hydroxy-5-methyl- 4-isoxazolyl)propionic acid] analogues at ionotropic glutamate receptors GluR1-GluR4. The molecular basis for the functional selectivity profile of 2-Bn-Tet-AMPA._||_Abstract: Four 2-substituted Tet-AMPA [Tet = tetrazolyl, AMPA = 2-amino-3-(3-hydroxy-5-methyl-4-isoxazolyl)propionic acid] analogues were characterized functionally at the homomeric AMPA receptors GluR1i, GluR2Qi, GluR3i, and GluR4i in a Fluo-4/Ca2+ assay. Whereas 2-Et-Tet-AMPA, 2-Pr-Tet-AMPA, and 2-iPr-Tet-AMPA were nonselective GluR agonists, 2-Bn-Tet-AMPA exhibited a 40-fold higher potency at GluR4i than at GluR1i. Examination of homology models of the S1-S2 domains of GluR1 and GluR4 containing 2-Bn-Tet-AMPA suggested four nonconserved residues in a region adjacent to the orthosteric site as possible determinants of the GluR4i/GluR1i selectivity. In a mutagenesis study, doubly mutating M686V/I687A in GluR1i in combination with either D399S or E683A increased both the potency and the maximal response of 2-Bn-Tet-AMPA at this receptor to levels similar to those elicited by the agonist at GluR4i. The dependence of the novel selectivity profile of 2-Bn-Tet-AMPA upon residues located outside of the orthosteric site underlines the potential for developing GluR subtype selective ligands by designing compounds with substituents that protrude beyond the (S)-Glu binding pocket.",43,ChEMBL,CHEMBL895676,20210302,,,2890,,P42261,Curation Efforts|Research and Development,17672447,0,,P42261,9606.0,45.0,,,0,0,1,1,0,0
297361,Literature-derived,Agonist activity at GluR1 D399S/E683A mutant expressed in HEK293 cells up to 3 mM by Fluo-4/Ca2+ assay relative to S-Glutamate,"Title: Functional characterization of Tet-AMPA [tetrazolyl-2-amino-3-(3-hydroxy-5-methyl- 4-isoxazolyl)propionic acid] analogues at ionotropic glutamate receptors GluR1-GluR4. The molecular basis for the functional selectivity profile of 2-Bn-Tet-AMPA._||_Abstract: Four 2-substituted Tet-AMPA [Tet = tetrazolyl, AMPA = 2-amino-3-(3-hydroxy-5-methyl-4-isoxazolyl)propionic acid] analogues were characterized functionally at the homomeric AMPA receptors GluR1i, GluR2Qi, GluR3i, and GluR4i in a Fluo-4/Ca2+ assay. Whereas 2-Et-Tet-AMPA, 2-Pr-Tet-AMPA, and 2-iPr-Tet-AMPA were nonselective GluR agonists, 2-Bn-Tet-AMPA exhibited a 40-fold higher potency at GluR4i than at GluR1i. Examination of homology models of the S1-S2 domains of GluR1 and GluR4 containing 2-Bn-Tet-AMPA suggested four nonconserved residues in a region adjacent to the orthosteric site as possible determinants of the GluR4i/GluR1i selectivity. In a mutagenesis study, doubly mutating M686V/I687A in GluR1i in combination with either D399S or E683A increased both the potency and the maximal response of 2-Bn-Tet-AMPA at this receptor to levels similar to those elicited by the agonist at GluR4i. The dependence of the novel selectivity profile of 2-Bn-Tet-AMPA upon residues located outside of the orthosteric site underlines the potential for developing GluR subtype selective ligands by designing compounds with substituents that protrude beyond the (S)-Glu binding pocket.",43,ChEMBL,CHEMBL895678,20210302,,,2890,,P42261,Curation Efforts|Research and Development,17672447,0,,P42261,9606.0,45.0,,,0,0,1,1,0,0
297365,Literature-derived,Agonist activity at GluR1 D399S/M686V/I687A mutant expressed in HEK293 cells up to 3 mM by Fluo-4/Ca2+ assay relative to S-Glutamate,"Title: Functional characterization of Tet-AMPA [tetrazolyl-2-amino-3-(3-hydroxy-5-methyl- 4-isoxazolyl)propionic acid] analogues at ionotropic glutamate receptors GluR1-GluR4. The molecular basis for the functional selectivity profile of 2-Bn-Tet-AMPA._||_Abstract: Four 2-substituted Tet-AMPA [Tet = tetrazolyl, AMPA = 2-amino-3-(3-hydroxy-5-methyl-4-isoxazolyl)propionic acid] analogues were characterized functionally at the homomeric AMPA receptors GluR1i, GluR2Qi, GluR3i, and GluR4i in a Fluo-4/Ca2+ assay. Whereas 2-Et-Tet-AMPA, 2-Pr-Tet-AMPA, and 2-iPr-Tet-AMPA were nonselective GluR agonists, 2-Bn-Tet-AMPA exhibited a 40-fold higher potency at GluR4i than at GluR1i. Examination of homology models of the S1-S2 domains of GluR1 and GluR4 containing 2-Bn-Tet-AMPA suggested four nonconserved residues in a region adjacent to the orthosteric site as possible determinants of the GluR4i/GluR1i selectivity. In a mutagenesis study, doubly mutating M686V/I687A in GluR1i in combination with either D399S or E683A increased both the potency and the maximal response of 2-Bn-Tet-AMPA at this receptor to levels similar to those elicited by the agonist at GluR4i. The dependence of the novel selectivity profile of 2-Bn-Tet-AMPA upon residues located outside of the orthosteric site underlines the potential for developing GluR subtype selective ligands by designing compounds with substituents that protrude beyond the (S)-Glu binding pocket.",43,ChEMBL,CHEMBL895682,20210302,,,2890,,P42261,Curation Efforts|Research and Development,17672447,0,,P42261,9606.0,45.0,,,0,0,1,1,0,0
297367,Literature-derived,Agonist activity at GluR1 E683A/M686V/I687A mutant expressed in HEK293 cells up to 3 mM by Fluo-4/Ca2+ assay relative to S-Glutamate,"Title: Functional characterization of Tet-AMPA [tetrazolyl-2-amino-3-(3-hydroxy-5-methyl- 4-isoxazolyl)propionic acid] analogues at ionotropic glutamate receptors GluR1-GluR4. The molecular basis for the functional selectivity profile of 2-Bn-Tet-AMPA._||_Abstract: Four 2-substituted Tet-AMPA [Tet = tetrazolyl, AMPA = 2-amino-3-(3-hydroxy-5-methyl-4-isoxazolyl)propionic acid] analogues were characterized functionally at the homomeric AMPA receptors GluR1i, GluR2Qi, GluR3i, and GluR4i in a Fluo-4/Ca2+ assay. Whereas 2-Et-Tet-AMPA, 2-Pr-Tet-AMPA, and 2-iPr-Tet-AMPA were nonselective GluR agonists, 2-Bn-Tet-AMPA exhibited a 40-fold higher potency at GluR4i than at GluR1i. Examination of homology models of the S1-S2 domains of GluR1 and GluR4 containing 2-Bn-Tet-AMPA suggested four nonconserved residues in a region adjacent to the orthosteric site as possible determinants of the GluR4i/GluR1i selectivity. In a mutagenesis study, doubly mutating M686V/I687A in GluR1i in combination with either D399S or E683A increased both the potency and the maximal response of 2-Bn-Tet-AMPA at this receptor to levels similar to those elicited by the agonist at GluR4i. The dependence of the novel selectivity profile of 2-Bn-Tet-AMPA upon residues located outside of the orthosteric site underlines the potential for developing GluR subtype selective ligands by designing compounds with substituents that protrude beyond the (S)-Glu binding pocket.",43,ChEMBL,CHEMBL895684,20210302,,,2890,,P42261,Curation Efforts|Research and Development,17672447,0,,P42261,9606.0,45.0,,,0,0,1,1,0,0
