aid,aidtype,aidname,aiddesc,aidsrcid,aidsrcname,aidextid,aidmdate,cids,sids,geneids,aidcategories,protacxns,depcatg,pmids,rnai,ecs,repacxns,taxids,cellids,targettaxid,annotation,partial_agonist_desc,partial_agonist_aidname,agonist_desc,agonist_aidname,antagonist_desc,antagonist_aidname
228320,Literature-derived,"Compound was evaluated for opioid receptor selectivity, expressed as Ki ratio (kappa/mu/delta); 1/27/108","Title: Synthesis and opioid activity of side-chain-to-side-chain cyclic dynorphin A-(1-11) amide analogues cyclized between positions 2 and 5. 1. Substitutions in position 3._||_Abstract: cyclo[d-Asp(2),Dap(5)]Dyn A-(1-13)NH(2) (Dap, 2,3-diaminopropionic acid; Dyn A, dynorphin A), synthesized previously in our laboratory, showed sub-nanomolar affinity for kappa opioid receptors and potent agonist activity in the guinea pig ileum assay (Arttamangkul et al., J. Med. Chem. 1995, 38, 2410-2417). Various modifications were made in position 3 of cyclo[d-Asp(2),Dap(5)]Dyn A-(1-11)NH(2) that could influence the opioid receptor affinity, selectivity, and/or efficacy of this peptide. An optimized orthogonal synthetic strategy was developed for the synthesis of these cyclic peptides in which the final peptides could be cleaved from the solid support with trifluoroacetic acid. Substitutions of Gly(3) by Ala, d-Ala, Trp, and d-Trp in cyclo[d-Asp(2),Dap(5)]Dyn A-(1-11)NH(2) and its linear counterpart [d-Asp(2),Dap(5)]Dyn A-(1-11)NH(2) were generally well tolerated by both kappa and micro opioid receptors. Despite differences in the size and stereochemistry of the substitutions, most of the peptides (except for cyclo[d-Asp(2),Pro(3),Dap(5)]Dyn A-(1-11)NH(2) and [d-Asp(2),d-Ala(3), Dap(5)]Dyn A-(1-11)NH(2)) exhibited low nanomolar affinity for both kappa (K(i) = 0.21 to 2.2 nM) and micro (K(i) = 0.22 to 7.27 nM) opioid receptors. All of the 3-substituted cyclic and linear analogues synthesized showed reduced affinity for delta opioid receptors. Incorporation of d-Ala at position 3 of cyclo[d-Asp(2),Dap(5)]Dyn A-(1-11)NH(2) exhibited 2-fold higher kappa opioid receptor affinity and 16-fold higher selectivity for kappa over micro opioid receptors than the parent cyclic peptide. In contrast, substitution of Ala at position 3 resulted in an analogue with 2.4-fold lower affinity and very low preference for kappa over micro opioid receptors. The Trp and d-Trp cyclic and linear analogues exhibited similar nanomolar affinities for kappa opioid receptors. cyclo[d-Asp(2),Pro(3),Dap(5)]Dyn A-(1-11)NH(2) showed the largest decreases in affinity for all three opioid receptors compared to the parent cyclic peptide. Except for cyclo[d-Asp(2), Pro(3),Dap(5)]Dyn A-(1-11)NH(2), which was a partial agonist, all of the cyclic peptides exhibited full agonist activity in the adenylyl cyclase assay using cloned kappa opioid receptors.",43,ChEMBL,CHEMBL883684,20181017,25075920,103380091,4985|4986|4988,,P35372|P41143|P41145,Curation Efforts|Research and Development,14711314,0,,P35372|P41143|P41145,,,,,1,0,1,0,0,0
228322,Literature-derived,"Compound was evaluated for opioid receptor selectivity, expressed as Ki ratio (kappa/mu/delta); 1/3.6/645","Title: Synthesis and opioid activity of side-chain-to-side-chain cyclic dynorphin A-(1-11) amide analogues cyclized between positions 2 and 5. 1. Substitutions in position 3._||_Abstract: cyclo[d-Asp(2),Dap(5)]Dyn A-(1-13)NH(2) (Dap, 2,3-diaminopropionic acid; Dyn A, dynorphin A), synthesized previously in our laboratory, showed sub-nanomolar affinity for kappa opioid receptors and potent agonist activity in the guinea pig ileum assay (Arttamangkul et al., J. Med. Chem. 1995, 38, 2410-2417). Various modifications were made in position 3 of cyclo[d-Asp(2),Dap(5)]Dyn A-(1-11)NH(2) that could influence the opioid receptor affinity, selectivity, and/or efficacy of this peptide. An optimized orthogonal synthetic strategy was developed for the synthesis of these cyclic peptides in which the final peptides could be cleaved from the solid support with trifluoroacetic acid. Substitutions of Gly(3) by Ala, d-Ala, Trp, and d-Trp in cyclo[d-Asp(2),Dap(5)]Dyn A-(1-11)NH(2) and its linear counterpart [d-Asp(2),Dap(5)]Dyn A-(1-11)NH(2) were generally well tolerated by both kappa and micro opioid receptors. Despite differences in the size and stereochemistry of the substitutions, most of the peptides (except for cyclo[d-Asp(2),Pro(3),Dap(5)]Dyn A-(1-11)NH(2) and [d-Asp(2),d-Ala(3), Dap(5)]Dyn A-(1-11)NH(2)) exhibited low nanomolar affinity for both kappa (K(i) = 0.21 to 2.2 nM) and micro (K(i) = 0.22 to 7.27 nM) opioid receptors. All of the 3-substituted cyclic and linear analogues synthesized showed reduced affinity for delta opioid receptors. Incorporation of d-Ala at position 3 of cyclo[d-Asp(2),Dap(5)]Dyn A-(1-11)NH(2) exhibited 2-fold higher kappa opioid receptor affinity and 16-fold higher selectivity for kappa over micro opioid receptors than the parent cyclic peptide. In contrast, substitution of Ala at position 3 resulted in an analogue with 2.4-fold lower affinity and very low preference for kappa over micro opioid receptors. The Trp and d-Trp cyclic and linear analogues exhibited similar nanomolar affinities for kappa opioid receptors. cyclo[d-Asp(2),Pro(3),Dap(5)]Dyn A-(1-11)NH(2) showed the largest decreases in affinity for all three opioid receptors compared to the parent cyclic peptide. Except for cyclo[d-Asp(2), Pro(3),Dap(5)]Dyn A-(1-11)NH(2), which was a partial agonist, all of the cyclic peptides exhibited full agonist activity in the adenylyl cyclase assay using cloned kappa opioid receptors.",43,ChEMBL,CHEMBL857536,20181017,25091607,103380852,4985|4986|4988,,P35372|P41143|P41145,Curation Efforts|Research and Development,14711314,0,,P35372|P41143|P41145,,,,,1,0,1,0,0,0
228324,Literature-derived,"Compound was evaluated for opioid receptor selectivity, expressed as Ki ratio (kappa/mu/delta); 1/63/90","Title: Synthesis and opioid activity of side-chain-to-side-chain cyclic dynorphin A-(1-11) amide analogues cyclized between positions 2 and 5. 1. Substitutions in position 3._||_Abstract: cyclo[d-Asp(2),Dap(5)]Dyn A-(1-13)NH(2) (Dap, 2,3-diaminopropionic acid; Dyn A, dynorphin A), synthesized previously in our laboratory, showed sub-nanomolar affinity for kappa opioid receptors and potent agonist activity in the guinea pig ileum assay (Arttamangkul et al., J. Med. Chem. 1995, 38, 2410-2417). Various modifications were made in position 3 of cyclo[d-Asp(2),Dap(5)]Dyn A-(1-11)NH(2) that could influence the opioid receptor affinity, selectivity, and/or efficacy of this peptide. An optimized orthogonal synthetic strategy was developed for the synthesis of these cyclic peptides in which the final peptides could be cleaved from the solid support with trifluoroacetic acid. Substitutions of Gly(3) by Ala, d-Ala, Trp, and d-Trp in cyclo[d-Asp(2),Dap(5)]Dyn A-(1-11)NH(2) and its linear counterpart [d-Asp(2),Dap(5)]Dyn A-(1-11)NH(2) were generally well tolerated by both kappa and micro opioid receptors. Despite differences in the size and stereochemistry of the substitutions, most of the peptides (except for cyclo[d-Asp(2),Pro(3),Dap(5)]Dyn A-(1-11)NH(2) and [d-Asp(2),d-Ala(3), Dap(5)]Dyn A-(1-11)NH(2)) exhibited low nanomolar affinity for both kappa (K(i) = 0.21 to 2.2 nM) and micro (K(i) = 0.22 to 7.27 nM) opioid receptors. All of the 3-substituted cyclic and linear analogues synthesized showed reduced affinity for delta opioid receptors. Incorporation of d-Ala at position 3 of cyclo[d-Asp(2),Dap(5)]Dyn A-(1-11)NH(2) exhibited 2-fold higher kappa opioid receptor affinity and 16-fold higher selectivity for kappa over micro opioid receptors than the parent cyclic peptide. In contrast, substitution of Ala at position 3 resulted in an analogue with 2.4-fold lower affinity and very low preference for kappa over micro opioid receptors. The Trp and d-Trp cyclic and linear analogues exhibited similar nanomolar affinities for kappa opioid receptors. cyclo[d-Asp(2),Pro(3),Dap(5)]Dyn A-(1-11)NH(2) showed the largest decreases in affinity for all three opioid receptors compared to the parent cyclic peptide. Except for cyclo[d-Asp(2), Pro(3),Dap(5)]Dyn A-(1-11)NH(2), which was a partial agonist, all of the cyclic peptides exhibited full agonist activity in the adenylyl cyclase assay using cloned kappa opioid receptors.",43,ChEMBL,CHEMBL849933,20181017,10374265,103380851,4985|4986|4988,,P35372|P41143|P41145,Curation Efforts|Research and Development,14711314,0,,P35372|P41143|P41145,,,,,1,0,1,0,0,0
228326,Literature-derived,"Compound was evaluated for opioid receptor selectivity, expressed as Ki ratio (kappa/mu/delta); 7.2/1/53","Title: Synthesis and opioid activity of side-chain-to-side-chain cyclic dynorphin A-(1-11) amide analogues cyclized between positions 2 and 5. 1. Substitutions in position 3._||_Abstract: cyclo[d-Asp(2),Dap(5)]Dyn A-(1-13)NH(2) (Dap, 2,3-diaminopropionic acid; Dyn A, dynorphin A), synthesized previously in our laboratory, showed sub-nanomolar affinity for kappa opioid receptors and potent agonist activity in the guinea pig ileum assay (Arttamangkul et al., J. Med. Chem. 1995, 38, 2410-2417). Various modifications were made in position 3 of cyclo[d-Asp(2),Dap(5)]Dyn A-(1-11)NH(2) that could influence the opioid receptor affinity, selectivity, and/or efficacy of this peptide. An optimized orthogonal synthetic strategy was developed for the synthesis of these cyclic peptides in which the final peptides could be cleaved from the solid support with trifluoroacetic acid. Substitutions of Gly(3) by Ala, d-Ala, Trp, and d-Trp in cyclo[d-Asp(2),Dap(5)]Dyn A-(1-11)NH(2) and its linear counterpart [d-Asp(2),Dap(5)]Dyn A-(1-11)NH(2) were generally well tolerated by both kappa and micro opioid receptors. Despite differences in the size and stereochemistry of the substitutions, most of the peptides (except for cyclo[d-Asp(2),Pro(3),Dap(5)]Dyn A-(1-11)NH(2) and [d-Asp(2),d-Ala(3), Dap(5)]Dyn A-(1-11)NH(2)) exhibited low nanomolar affinity for both kappa (K(i) = 0.21 to 2.2 nM) and micro (K(i) = 0.22 to 7.27 nM) opioid receptors. All of the 3-substituted cyclic and linear analogues synthesized showed reduced affinity for delta opioid receptors. Incorporation of d-Ala at position 3 of cyclo[d-Asp(2),Dap(5)]Dyn A-(1-11)NH(2) exhibited 2-fold higher kappa opioid receptor affinity and 16-fold higher selectivity for kappa over micro opioid receptors than the parent cyclic peptide. In contrast, substitution of Ala at position 3 resulted in an analogue with 2.4-fold lower affinity and very low preference for kappa over micro opioid receptors. The Trp and d-Trp cyclic and linear analogues exhibited similar nanomolar affinities for kappa opioid receptors. cyclo[d-Asp(2),Pro(3),Dap(5)]Dyn A-(1-11)NH(2) showed the largest decreases in affinity for all three opioid receptors compared to the parent cyclic peptide. Except for cyclo[d-Asp(2), Pro(3),Dap(5)]Dyn A-(1-11)NH(2), which was a partial agonist, all of the cyclic peptides exhibited full agonist activity in the adenylyl cyclase assay using cloned kappa opioid receptors.",43,ChEMBL,CHEMBL848502,20181017,25077549,103380478,4985|4986|4988,,P35372|P41143|P41145,Curation Efforts|Research and Development,14711314,0,,P35372|P41143|P41145,,,,,1,0,1,0,0,0
282134,Confirmatory,Activity at human recombinant delta opioid receptor expressed in CHO cells by [35S]GTP-gamma-S binding assay,"Title: Effects of substitution on the pyrrole N atom in derivatives of tetrahydronaltrindole, tetrahydrooxymorphindole, and a related 4,5-epoxyphenylpyrrolomorphinan._||_Abstract: The effect of substitution of the pyrrolo- and indolo-N atoms in tetrahydronaltrindole (TNTI), tetrahydrooxymorphindole (TOMI), and 17-cyclopropylmethyl-3,14-dihydroxy-4,5-epoxy-4'-phenyl-6,7:2',3'-pyrrolomorphinan (4) is reported. In opioid functional assays 4 were potent deltaopioid receptor (DOR) antagonists while the TNTI derivatives (7) were potent DOR antagonists or low-efficacy DOR partial agonists without substantial selectivity. The TOMI derivatives (8) were DOR agonists with significant selectivity. In vivo the DOR antagonist activity of 7d was confirmed, but the predominant agonist effect of 8d was shown to be mu opioid receptor mediated.",43,ChEMBL,CHEMBL919069,20181021,5497186|44367136|44421393|44421396|44421399|44421400|44421401|44421403|44421406|44421407|44421408|44421409|44421412|44421422|46877642,103397313|103512674|103512680|103512689|103512690|103512699|103512710|103512715|103512716|103512720|103512721|103512727|103512739|103697951|103734702,4985,,P41143,Curation Efforts|Research and Development,15588100,0,,P41143,9606.0,197.0,,,1,0,1,0,1,0
392932,Confirmatory,Displacement of [125I]deltorphin 2 from human cloned delta opioid receptor,"Title: Discovery of mu-opioid selective ligands derived from 1-aminotetralin scaffolds made via metal-catalyzed ring-opening reactions._||_Abstract: A series of 1-aminotetralin scaffolds was synthesized via metal-catalyzed ring-opening reactions of heterobicyclic alkenes. Small libraries of amides and amines were made using the amino group of each scaffold as a handle. Screening of these libraries against human opioid receptors led to the identification of (S)-(S)-5.2a as a high-affinity selective mu ligand (IC(50)mu=5 nM, kappa=707 nM, delta=3,795 nM) displaying mu-agonist/antagonist properties due to its partial agonism (EC(50)=2.6 microM; E(max)=18%).",43,ChEMBL,CHEMBL1030681,20180910,44590514|44590551|44590552|44590553|44590554|44590580|44590581|44590582|44590629|44590630|44590631|44590632|44590677|44590678,103650030|103650117|103650118|103650119|103650120|103650186|103650187|103650188|103650259|103650260|103650261|103650262|103650360|103650361,4985,,P41143,Curation Efforts|Research and Development,19168350,0,,P41143,9606.0,,,,1,0,1,0,1,0
395294,Confirmatory,Displacement of [3H]DPDPE from human delta opioid receptor expressed in CHO cells,"Title: 14 beta-O-cinnamoylnaltrexone and related dihydrocodeinones are mu opioid receptor partial agonists with predominant antagonist activity._||_Abstract: 14-O-Cinnamoyl esters of naltrexone (6) were synthesized and evaluated in isolated tissue assays in vitro and in vivo in mouse antinociceptive assays. Their predominant opioid receptor activity was mu receptor (MOR) antagonism, but the unsubstituted cinnamoyl derivative (6a) had partial MOR agonist activity in vitro and in vivo. When compared to the equivalent 14-cinnamoylaminomorphinones (5), the cinnamoyloxy morphinones (6) as MOR antagonists had a shorter duration of action and were less effective as pseudoirreversible antagonists. The antinociceptive activity of the cinnamoyloxycodeinones (7) was not significantly greater than that of the morphinones (6), but they exhibited no evidence of any pseudoirreversible MOR antagonism. In both respects, these profiles differed from those of the equivalent 14-cinnamoylaminocodeinones (4).",43,ChEMBL,CHEMBL1022993,20180910,5360515|6540640|25257431|25257432|25257433|44417373|44565511,103500772|103500889|103594951|103594952|103595014|103595015|131283791,4985,,P41143,Curation Efforts|Research and Development,19253983,0,,P41143,9606.0,197.0,,,1,0,1,0,1,0
440058,Confirmatory,Displacement of [3H]naltrindole from human delta opioid receptor expressed in CHO cells after 3 hrs by liquid scintillation counting,"Title: Univalent and bivalent ligands of butorphan: characteristics of the linking chain determine the affinity and potency of such opioid ligands._||_Abstract: Bivalent morphinan compounds containing ester linkers were synthesized and their binding affinities at the mu, delta, and kappa opioid receptors determined. Addition of methyl groups adjacent to the hydrolytically labile ester linkage increased stability while only partially affecting binding affinity. The resulting bivalent ligands with optimized spacer length and structure show potent binding profiles with the most potent compound (4b), having K(i) values of 0.47 nM for both the mu and kappa opioid receptors, and 4a, having K(i) values of 0.95 and 0.62 nM for the mu and kappa receptors, respectively. Both 4a and 4b were partial agonists at the kappa and micro receptors in the [(35)S]GTPgammaS binding assay.",43,ChEMBL,CHEMBL1056141,20180911,9804450|9897164|11677662|44597597|44597714|44597715|44597828|44597830|44597831|44597940|45483978|45483979,103230837|103393362|103700268|103700302|103700323|103700324|103700325|103700326|103700327|103700328|103700329|103700330,4985,,P41143,Curation Efforts|Research and Development,19634902,0,,P41143,9606.0,197.0,,,1,0,1,0,0,0
443798,Confirmatory,Displacement of [125I]OXY from human delta opioid receptor expressed in CHO cells,"Title: Synthesis and opioid activity of enantiomeric N-substituted 2,3,4,4a,5,6,7,7a-octahydro-1H-benzofuro[3,2-e]isoquinolines._||_Abstract: A series of enantiomeric N-substituted 2,3,4,4a,5,6,7,7a-octahydro-1H-benzofuro[3,2-e]isoquinolines was synthesized. The (-)-enantiomers had much greater kappa-, mu-, and delta-opioid receptor binding affinity than the corresponding (+)-enantiomers. Compounds (-)-1a, (-)-1b, and (-)-1c displayed subnanomolar binding affinity for the mu-receptor, and (-)-1b had a high affinity for the kappa-receptor. Compound (-)-1a was a mu-partial agonist and kappa-antagonist. Compound (-)-1b was a potent neutral mu-antagonist (K(d) = 0.22 nM) and a kappa-partial agonist.",43,ChEMBL,CHEMBL1038967,20180911,9669|5284596|11129476|11140284|12191611|12191612|44336365|45487174|45487200|45487206,103170037|103325420|103707514|103707538|103707546|103707556|103707576|103707591|103707605|163336456,4985,,P41143,Curation Efforts|Research and Development,20055417,0,,P41143,9606.0,197.0,,,1,0,1,0,1,0
450626,Literature-derived,Displacement of [3H]diprenorphine from FLAG-tagged delta opioid receptor expressed in HEK293 cells by liquid scintillation counting,"Title: Novel delta opioid receptor agonists exhibit differential stimulation of signaling pathways._||_Abstract: A novel family of 1,3,5-trisubstituted 1,2,4-triazoles was discovered as potent and selective ligands for the delta opioid receptor by rational design. Compound 5b exhibited low-nanomolar in vitro binding affinity (IC(50)=5.8 nM), excellent selectivity for the delta opioid receptor over the alternative mu and kappa opioid receptors, full agonist efficacy in receptor down-regulation and MAP kinase activation assays, and low-efficacy partial agonist activity in stimulation of GTPgammaS binding. The apparent discrepancy observed in these functional assays may stem from different signaling pathways involved in each case, as found previously for other G-protein coupled receptors. More biological studies are underway to better understand the differential stimulation of signaling pathways by these novel compounds.",43,ChEMBL,CHEMBL1049582,20180911,11957735|24802609|25000426|46226512|46226526,103718999|103719014|103719038|103719047|103719063,4985,,P41143,Curation Efforts|Research and Development,19646882,0,,P41143,,45.0,,,1,0,1,0,0,0
621888,Confirmatory,Displacement of [3H]Cl-DPDPE from human DOP receptor expressed in CHO cells after 60 mins by scintillation counting,"Title: Structural determinants of opioid and NOP receptor activity in derivatives of buprenorphine._||_Abstract: The unique pharmacological profile of buprenorphine has led to its considerable success as an analgesic and as a treatment agent for drug abuse. Activation of nociceptin/orphanin FQ peptide (NOP) receptors has been postulated to account for certain aspects of buprenorphine's behavioral profile. In order to investigate the role of NOP activation further, a series of buprenorphine analogues has been synthesized with the aim of increasing affinity for the NOP receptor. Binding and functional assay data on these new compounds indicate that the area around C20 in the orvinols is key to NOP receptor activity, with several compounds displaying higher affinity than buprenorphine. One compound, 1b, was found to be a mu opioid receptor partial agonist of comparable efficacy to buprenorphine but with higher efficacy at NOP receptors.",43,ChEMBL,CHEMBL1839053,20180919,105104|5462471|9848990|16131448|44299404|54756989|54756990|56658044|56661555|56664973|56668405|56681954|56681955,103177815|103217856|103243877|103532611|134434452|134438317|134442153|134442154|134445998|134457609|134461397|134461398|175265278,4985,,P41143,Curation Efforts|Research and Development,21866885,0,,P41143,9606.0,197.0,,,1,0,1,0,0,0
622124,Literature-derived,Binding affinity to delta opioid receptor at 10 uM by radioligand displacement assay,"Title: Discovery of isoxazole analogues of sazetidine-A as selective α4β2-nicotinic acetylcholine receptor partial agonists for the treatment of depression._||_Abstract: Depression, a common neurological condition, is one of the leading causes of disability and suicide worldwide. Standard treatment, targeting monoamine transporters selective for the neurotransmitters serotonin and noradrenaline, is not able to help many patients that are poor responders. This study advances the development of sazetidine-A analogues that interact with α4β2 nicotinic acetylcholine receptors (nAChRs) as partial agonists and that possess favorable antidepressant profiles. The resulting compounds that are highly selective for the α4β2 subtype of nAChR over α3β4-nAChRs are partial agonists at the α4β2 subtype and have excellent antidepressant behavioral profiles as measured by the mouse forced swim test. Preliminary absorption, distribution, metabolism, excretion, and toxicity (ADMET) studies for one promising ligand revealed an excellent plasma protein binding (PPB) profile, low CYP450-related metabolism, and low cardiovascular toxicity, suggesting it is a promising lead as well as a drug candidate to be advanced through the drug discovery pipeline.",43,ChEMBL,CHEMBL1838054,20200629,56595309,134450722,4985,,P41143,Curation Efforts|Research and Development,21905669,0,,P41143,,,,,1,0,1,0,0,0
658880,Literature-derived,Displacement of [3H]DADLE from delta opioid receptor at 10 uM,"Title: Chemistry and behavioral studies identify chiral cyclopropanes as selective α4β2-nicotinic acetylcholine receptor partial agonists exhibiting an antidepressant profile._||_Abstract: Despite their discovery in the early 20th century and intensive study over the last 20 years, nicotinic acetylcholine receptors (nAChRs) are still far from being well understood. Only a few chemical entities targeting nAChRs are currently undergoing clinical trials, and even fewer have reached the marketplace. In our efforts to discover novel and truly selective nAChR ligands, we designed and synthesized a series of chiral cyclopropane-containing α4β2-specific ligands that display low nanomolar binding affinities and excellent subtype selectivity while acting as partial agonists at α4β2-nAChRs. Their favorable antidepressant-like properties were demonstrated in the classical mouse forced swim test. Preliminary ADMET studies and broad screening toward other common neurotransmitter receptors were also carried out to further evaluate their safety profile and eliminate their potential off-target activity. These highly potent cyclopropane ligands possess superior subtype selectivity compared to other α4β2-nAChR agonists reported to date, including the marketed drug varenicline, and therefore may fully satisfy the crucial prerequisite for avoiding adverse side effects. These novel chemical entities could potentially be advanced to the clinic as new drug candidates for treating depression.",43,ChEMBL,CHEMBL2026387,20200626,45254040|56951368|56951495,160678244|160688954|160705128,4985,,P41143,Curation Efforts|Research and Development,22171543,0,,P41143,,,,,1,0,1,0,0,0
670114,Literature-derived,Displacement of [3H]-naltrindole from human delta opioid receptor expressed in CHO cells at 10 uM after 3 hrs by scintillation counting,"Title: Synthesis, binding affinity, and functional in vitro activity of 3-benzylaminomorphinan and 3-benzylaminomorphine ligands at opioid receptors._||_Abstract: A series of 3-benzylamino-3-desoxymorphinan (I) and 3-benzylamino-3-desoxymorphine (II) derivatives were synthesized and evaluated for their binding affinities, and functional activity data are presented at MOR, KOR, and DOR. Some of these ligands were found to have high binding affinity at MOR and KOR and displayed increased selectivity at MOR over KOR and DOR compared to butorphan or cyclorphan. The most selective compound, 3-(3'-hydroxybenzyl)amino-17-methylmorphinan (4g) (24-fold MOR to KOR and 1700-fold MOR to DOR) also showed high binding affinity (0.42 nM to MOR) and was a full agonist in the [(35)S]GTPγS binding assay. 2-(3'-Hydroxybenzyl)amino-17-cyclopropylmethylmorphinan (17) was found to be a KOR-selective ligand (150-fold over MOR and >10000-fold over the DORs). Most 3-benzylaminomorphinan derivatives were partial agonists at MOR and full agonists at KOR in the [(35)S]GTPγS binding assay.",43,ChEMBL,CHEMBL2050636,20200627,5284569|57412421|57412591|57412593|57412595|57412597|57412599|57412771,103526751|160679717|160679718|160685068|160685069|160701253|160706529|160706530,4985,,P41143,Curation Efforts|Research and Development,22439881,0,,P41143,9606.0,197.0,,,1,0,1,0,0,0
