,aid,aidtype,aidname,aiddesc,aidsrcid,aidsrcname,aidextid,aidmdate,cids,sids,geneids,aidcategories,protacxns,depcatg,pmids,rnai,ecs,repacxns,taxids,cellids,targettaxid,annotation,partial_agonist_desc,partial_agonist_aidname,agonist_desc,agonist_aidname,antagonist_desc,antagonist_aidname
163,350957,Literature-derived,Inhibition of ORL1 receptor at 10 uM,"Title: Efficacy, pharmacokinetics, and metabolism of tetrahydroquinoline inhibitors of Plasmodium falciparum protein farnesyltransferase._||_Abstract: New antimalarials are urgently needed. We have shown that tetrahydroquinoline (THQ) protein farnesyltransferase (PFT) inhibitors (PFTIs) are effective against the Plasmodium falciparum PFT and are effective at killing P. falciparum in vitro. Previously described THQ PFTIs had limitations of poor oral bioavailability and rapid clearance from the circulation of rodents. In this paper, we validate both the Caco-2 cell permeability model for predicting THQ intestinal absorption and the in vitro liver microsome model for predicting THQ clearance in vivo. Incremental improvements in efficacy, oral absorption, and clearance rate were monitored by in vitro tests; and these tests were followed up with in vivo absorption, distribution, metabolism, and excretion studies. One compound, PB-93, achieved cure when it was given orally to P. berghei-infected rats every 8 h for a total of 72 h. However, PB-93 was rapidly cleared, and dosing every 12 h failed to cure the rats. Thus, the in vivo results corroborate the in vitro pharmacodynamics and demonstrate that 72 h of continuous high-level exposure to PFTIs is necessary to kill plasmodia. The metabolism of PB-93 was demonstrated by a novel technique that relied on double labeling with a radiolabel and heavy isotopes combined with radiometric liquid chromatography and mass spectrometry. The major liver microsome metabolite of PB-93 has the PFT Zn-binding N-methyl-imidazole removed; this metabolite is inactive in blocking PFT function. By solving the X-ray crystal structure of PB-93 bound to rat PFT, a model of PB-93 bound to malarial PFT was constructed. This model suggests areas of the THQ PFTIs that can be modified to retain efficacy and protect the Zn-binding N-methyl-imidazole from dealkylation.",43,ChEMBL,CHEMBL1022877,20180910,17758320,103530856,4987,,P41146,Curation Efforts|Research and Development,17606674,0,,P41146,,,,,0,0,0,0,0,0
165,351302,Confirmatory,Antagonist activity against ORL1 receptor by [S35]GTPgammaS binding,"Title: 2-Cyclohexylcarbonylbenzimidazoles as potent, orally available and brain-penetrable opioid receptor-like 1 (ORL1) antagonists._||_Abstract: The synthesis and biological evaluation of new potent opioid receptor-like 1 (ORL1) antagonists are presented. Conversion of the thioether linkage of the prototype [It is reported prior to this communication as a consecutive series.: Kobayashi, K.; Kato, T.; Yamamoto, I.; Shimizu, A.; Mizutani, S.; Asai, M.; Kawamoto, H.; Ito, S.; Yoshizumi, T.; Hirayama, M.; Ozaki, S.; Ohta, H.; Okamoto, O. Bioorg. Med. Chem. Lett., in press] to the carbonyl linker effectively reduces susceptibility to P-glycoprotein (P-gp) efflux. This finding led to the identification of 2-cyclohexylcarbonylbenzimizole analogue 7c, which exhibited potent ORL1 activity, excellent selectivity over other receptors and ion channels, and poor susceptibility to P-gp. Compound 7c also showed satisfactory pharmacokinetic profiles and brain penetrability in laboratory animals. Furthermore, 7c showed good in vivo antagonism. Hence, 7c was selected as a clinical candidate for a brain-penetrable ORL1 antagonist.",43,ChEMBL,CHEMBL1014962,20180910,9823363|44143432|44143434|44143435|44143436|44143437,103614145|103615612|103615613|103615614|103615615|103615759,4987,,P41146,Curation Efforts|Research and Development,19394217,0,,P41146,,,,,0,0,1,1,1,1
167,351803,Confirmatory,Antagonist activity at ORL1 receptor expressed in CHO cells assessed as inhibition of NC/OFQ-stimulated [35S]GTPgammaS binding,Title: Optimization of benzimidazole series as opioid receptor-like 1 (ORL1) antagonists: SAR study directed toward improvement of selectivity over hERG activity._||_Abstract: A structure-activity relationship (SAR) study on the benzimidazole series of opioid receptor-like 1 (ORL1) antagonists related to 1 is described. Optimization of 1 by introduction of a hydrophilic substituent into the thioether part resulted in identification of potent ORL1 antagonists with high selectivity over binding affinity for hERG and other opioid receptors.,43,ChEMBL,CHEMBL972464,20180910,24857819|44143432|44143433|44143438|44143442|44143445|44143446|44143448|44143449|44143450|44143451|44143452|44143453|44143454|44143455|44143456|44143457|44574003|44574053,103614001|103614002|103614078|103614079|103614142|103614143|103614144|103614145|103614218|103614219|103614220|103614221|103614295|103614296|103614297|103614298|103614369|103614370|103614371|103614372,4987,,P41146,Curation Efforts|Research and Development,19398200,0,,P41146,,197.0,,,0,0,1,1,1,1
168,352469,Confirmatory,Displacement of [125I][Tyr14]nociceptin from human cloned ORL1 receptor expressed in CHO cells,"Title: Identification of 3-substituted N-benzhydryl-nortropane analogs as nociceptin receptor ligands for the management of cough and anxiety._||_Abstract: A series of nortropane analogs based on previously reported compound 1 have been synthesized and shown to bind to the nociceptin receptor with high affinity. The synthesis and structure-activity relationships around the C-3 nortropane substitution are described. From the SAR study and hPXR screening effort, compound 15 was identified to possess potent oral antitussive and anxiolytic-like activities in the guinea pig models.",43,ChEMBL,CHEMBL1009675,20180910,25235412|44247589|44574958|44575043|76309739|76309740|76313421|76313422|76313423|76313424|76313425|76313426|76313427|76316935|76316936|76316937|76320663|76320664|76320665|76320666|76324308|76324309|76324310|76324311|76327872|76327873|76327874|76327875|76327876|76327877|76331524|76331525|76335140|76335141|76335142|76335143|76335144|76335145,103615795|103615945|194137830|194137831|194144712|194144713|194144714|194144715|194144716|194144717|194144718|194151542|194151543|194151544|194158559|194158560|194158561|194158562|194158563|194158564|194165496|194165497|194165498|194165499|194172352|194172353|194172354|194172355|194172356|194172357|194179189|194179190|194186041|194186042|194186043|194186044|194186045|194186046,4987,,P41146,Curation Efforts|Research and Development,19332374,0,,P41146,9606.0,197.0,,,0,0,0,0,0,0
179,375082,Confirmatory,Antagonist activity at ORL1 receptor expressed in CHO cells assessed as inhibition of NC/OFQ-stimulated [35S]GTPgammaS binding,"Title: Discovery of novel arylpyrazole series as potent and selective opioid receptor-like 1 (ORL1) antagonists._||_Abstract: The synthesis and biological evaluation of new potent opioid receptor-like 1 antagonists are presented. A structure-activity relationship (SAR) study of arylpyrazole lead compound 1 obtained from library screening identified compound 31, (1S,3R)-N-{[1-(3-chloropyridin-2-yl)-5-(5-fluoro-6-methylpyridin-3-yl)-4-methyl-1H-pyrazol-3-yl]methyl}-3-fluorocyclopentanamine, which exhibits high intrinsic potency and selectivity against other opioid receptors and hERG potassium channel.",43,ChEMBL,CHEMBL1007469,20180910,44143406|44143418|44143419|44143427|44143428|44143429|44143430|44143431,103613825|103613826|103613890|103614628|103614629|103614630|103614631|103614691,4987,,P41146,Curation Efforts|Research and Development,19447610,0,,P41146,,197.0,,,0,0,1,1,1,1
180,375525,Confirmatory,Antagonist activity at human recombinant NOP receptor expressed in CHO cells coexpressing alphaqi5 assessed as inhibition of N/OFQ-induced intracellular calcium mobilization,Title: Further studies at neuropeptide s position 5: discovery of novel neuropeptide S receptor antagonists._||_Abstract: Neuropeptide S (NPS) regulates various biological functions by activating the NPS receptor (NPSR). Previous studies demonstrated that the substitution of Gly(5) with d-amino acids generates NPSR antagonists. Eleven [d-Xaa(5)]NPS derivatives were synthesized and pharmacologically tested measuring [Ca(2+)](i) in HEK293(mNPSR) cells. The results confirmed that the [d-Xaa(5)] substitution promotes antagonist activity with potency inversely related to the side chain size and allowed identification of the novel potent NPSR peptide antagonist [(t)Bu-d-Gly(5)]NPS.,43,ChEMBL,CHEMBL1001568,20180910,16131448|44186330,103532611|124959284,4987,,P41146,Curation Efforts|Research and Development,19473027,0,,P41146,9606.0,197.0,,,0,0,1,1,1,1
181,375532,Literature-derived,Antagonist activity at human recombinant NOP receptor expressed in CHO cells coexpressing alphaqi5 assessed as inhibition of N/OFQ-induced intracellular calcium mobilization at up to 10 uM,Title: Further studies at neuropeptide s position 5: discovery of novel neuropeptide S receptor antagonists._||_Abstract: Neuropeptide S (NPS) regulates various biological functions by activating the NPS receptor (NPSR). Previous studies demonstrated that the substitution of Gly(5) with d-amino acids generates NPSR antagonists. Eleven [d-Xaa(5)]NPS derivatives were synthesized and pharmacologically tested measuring [Ca(2+)](i) in HEK293(mNPSR) cells. The results confirmed that the [d-Xaa(5)] substitution promotes antagonist activity with potency inversely related to the side chain size and allowed identification of the novel potent NPSR peptide antagonist [(t)Bu-d-Gly(5)]NPS.,43,ChEMBL,CHEMBL1001575,20180910,16131448|44186330,103532611|124959284,4987,,P41146,Curation Efforts|Research and Development,19473027,0,,P41146,9606.0,197.0,,,0,0,1,1,1,1
182,392711,Confirmatory,Displacement of [125I]nociceptin from human NOP expressed in CHO cells,Title: Synthesis and structure-activity relationships of N-substituted spiropiperidines as nociceptin receptor ligands: part 2._||_Abstract: A series of N-8 substituted analogs based upon the spiropiperidine core of the original lead compound 1 was synthesized. This lead has been elaborated to compounds to give compounds 2 and 3 (R=H) that exhibited high NOP binding affinity as well as selectivity against other known opioid receptors. These two series have been further functionalized at the amido nitrogen. The synthesis and structure-activity relationship (SAR) of these and related compounds are discussed.,43,ChEMBL,CHEMBL1030622,20180910,3396|9806799|9934232|9937777|10158555|10252647|10323169|15541261|23383556|25190572|25190573|25190574|25190575|25190576|25190577|25190578|25190579|25190580|25190581|25190582|25190583|25190584|25190585|25190586|25190587|25190588|25190589|25190590|25190591|25190592|25190593|25190594|25190595|25190596|25190597|25190598|25190599|25190600|25190601|25190602|25190603|25190604|25190605|25190606|25190607|25190608|25190609|25190610|25190611|25190612|25190613|25190614|25190615|25190616|25190617|25190618|25190619|25190620|25190621|25190622|25190623|25190624|25190625|25190626|25190627|25190628|25190629|25190630,103224650|103546523|103546588|103546597|103546603|103650925|103650926|103650927|103650928|103650988|103651108|103651109|103651110|103651111|103651112|103651157|103651158|103651159|103651213|103651214|103651215|103651216|103651277|103651278|103651279|103651280|103651320|103651321|103651322|103651371|103651372|103651373|103651374|103651413|103651414|103651415|103651416|103651465|103651466|103651467|103651468|103651469|103651512|103651513|103651514|103651515|103651516|103651567|103651568|103651569|103651570|103651571|103651572|103651573|103651630|103651631|103651632|103651633|103651634|103651635|103651698|103651699|103651700|103651701|103651753|103651754|103651755|103651756,4987,,P41146,Curation Efforts|Research and Development,19147350,0,,P41146,9606.0,197.0,,,0,0,0,0,0,0
187,408037,Confirmatory,Antagonist activity at human ORL1 receptor by [35S]GTPgammaS binding assay,"Title: Novel ORL1-selective antagonists with oral bioavailability and brain penetrability._||_Abstract: Following the discovery of 5-chloro-6-[piperazin-1-yl]-1H-benzimidazole as a novel pharmacophore for potent and selective ORL1 antagonist activity, optimization of this new lead by introduction of a methyl substitution on the piperazine ring resulted in a highly potent and selective, orally available, and brain penetrable ORL1 antagonist, 2-(tert-butylthio)-5-chloro-6-[(2R)-4-(2-hydroxyethyl)-2-methylpiperazin-1-yl]-1H-benzimidazole. Stereochemistry of the methyl substituent on the piperazine ring to control the functional activity of other opioid receptors is also described.",43,ChEMBL,CHEMBL953419,20181025,10221539|22272877|24857819|24857820|44576625|44576626|44576627|44576628,103565501|103565543|103565546|103614001|103620367|103620368|103620369|103620370,4987,,P41146,Curation Efforts|Research and Development,18448337,0,,P41146,9606.0,,,,0,0,1,1,1,1
188,411120,Confirmatory,Displacement of [125I][Tyr14]nociceptin FQ from human cloned nociceptin receptor expressed in CHO cells,Title: Structure-activity relationships of 3-substituted N-benzhydryl-nortropane analogs as nociceptin receptor ligands for the treatment of cough._||_Abstract: A series of 3-axial-aminomethyl-N-benzhydryl-nortropane analogs have been synthesized and identified to bind to the nociceptin receptor with high affinity. Many of these analogs showed high binding selectivity over classic opioid receptors such as mu receptor. The synthesis and structure-activity relationships around the C-3 nortropane substitution are described. Selected compounds with potent oral antitussive activity in the guinea pig model are disclosed.,43,ChEMBL,CHEMBL1012094,20181026,16733371|25235412|118718262|118718263|118718264|118718265|118718266|118718267|118718268|118718269|118718270|118718271|118718272|118718273|118718274|118718275|118718276|118718277|118718278|118718279|118718280|118718281|118718282|118718283|118718284|118718285|118718286|118718287|118718288|118718289|118718290|118718291|118718292|118718293|118718294|118718295|118718296|118718297|118718298|118718299|118718300|118718301|118718302,312364747|312364748|312364749|312364750|312364751|312364752|312364753|312364754|312364755|312364756|312364757|312364758|312364759|312364760|312364761|312364762|312364763|312364764|312364765|312364766|312364767|312364768|312364769|312364770|312364771|312364772|312364773|312364774|312364775|312364776|312364777|312364778|312364779|312364780|312364781|312364782|312364783|312364784|312364785|312364786|312364787|312364788|312364789,4987,,P41146,Curation Efforts|Research and Development,18990569,0,,P41146,9606.0,197.0,,,0,0,0,0,0,0
193,421229,Confirmatory,Antagonist activity at human ORL1 receptor expressed in CHO cells by [35S]GTPgammaS binding assay,"Title: Identification of an orally active opioid receptor-like 1 (ORL1) receptor antagonist 4-{3-[(2R)-2,3-dihydroxypropyl]-2-oxo-2,3-dihydro-1H-benzimidazol-1-yl}-1-[(1S,3S,4R)-spiro[bicyclo[2.2.1]heptane-2,1'-cyclopropan]-3-ylmethyl]piperidine as clinical candidate._||_Abstract: Our efforts to optimize prototype opioid receptor-like 1 (ORL1) antagonist 1 led to the discovery of 4-{3-[(2R)-2,3-dihydroxypropyl]-2-oxo-2,3-dihydro-1H-benzimidazol-1-yl}-1-[(1S,3S,4R)-spiro[bicyclo[2.2.1]heptane-2,1'-cyclopropan]-3-ylmethyl]piperidine 10. 10 showed potent ORL1 antagonistic activity, excellent selectivity over other opioid receptors, and in vivo efficacy after oral dosing. Currently clinical trials of 10 are underway.",43,ChEMBL,CHEMBL1025189,20180910,44189732|44189734|44189833,103680520|103682252|103685704,4987,,P41146,Curation Efforts|Research and Development,19537798,0,,P41146,9606.0,197.0,,,0,0,1,1,1,1
198,429454,Confirmatory,Antagonist activity at human cloned ORL1 receptor expressed in CHO cells assessed as inhibition of nociceptin/orphanin FQ-stimulated [35S]GTPgammaS binding,"Title: Synthesis and biological evaluation of imidazole derivatives as novel NOP/ORL1 receptor antagonists: exploration and optimization of alternative pyrazole structure._||_Abstract: Nonpeptidic small-molecule NOP/ORL1 receptor antagonists with an imidazole scaffold were designed and synthesized to investigate alternatives to the pyrazole analog. Systematic modification of the original pyrazole lead [Kobayashi et al., Bioorg. Med. Chem. Lett.2009, 19, 3627; Kobayashi et al., Bioorg. Med. Chem. Lett., in press] to change the heterocyclic core, substituted side chain, and pendant functional group demonstrated that examining the structure-activity relationship for novel templates allowed the identification of potent, fully substituted 4-aminomethyl-1H-imidazole and 2-aminomethyl-1H-imidazole. These compounds exhibited excellent potency for ORL1 receptor with minimal P-gp efflux and/or reduced hERG affinity.",43,ChEMBL,CHEMBL1059780,20180911,44517710|45268498|45269357|45269358|45270184|45271015|45271041|45273679,103683384|103685077|103685078|103686846|103688638|103688684|103693957|103693992,4987,,P41146,Curation Efforts|Research and Development,19604695,0,,P41146,9606.0,197.0,,,0,0,1,1,1,1
200,430896,Confirmatory,Antagonist activity at ORL1 receptor by [35S]GTPgammaS binding assay,"Title: Identification of MK-1925: a selective, orally active and brain-penetrable opioid receptor-like 1 (ORL1) antagonist._||_Abstract: Structure-activity relationship studies directed toward improving the metabolic stability of compound 1 resulted in the identification of 3-[5-(3,5-difluorophenyl)-3-({[(1S,3R)-3-fluorocyclopentyl]amino}methyl)-4-methyl-1H-pyrazol-1-yl]propanenitrile 39 (MK-1925) as a selective, orally available and brain-penetrable opioid receptor-like 1 (ORL1) antagonist. The compound also showed in vivo efficacy after oral dosing. Therefore, compound 39 was selected to undergo further studies as a clinical candidate.",43,ChEMBL,CHEMBL1059900,20180911,44143431|44178080|45267505|45268355|45270082|45270907|45270917|45272626|45273531|45273537|45273546,103614691|103681459|103681466|103683158|103686668|103688452|103688461|103691916|103693732|103693739|103693750,4987,,P41146,Curation Efforts|Research and Development,19564110,0,,P41146,,,,,0,0,1,1,1,1
203,450032,Confirmatory,Antagonist activity at NOP expressed in HEK293 cells assessed as inhibition of compound 15-induced [35S]GTPgammaS binding,"Title: Synthesis and pharmacological evaluation of 6-naltrexamine analogs for alcohol cessation._||_Abstract: A series of substituted aryl amide derivatives of 6-naltrexamine, 3 designed to be metabolically stable were synthesized and used to characterize the structural requirements for their potency to binding and functional activity of human mu (mu), delta (delta) and kappa (kappa) opioid and nociceptin (NOP) receptors. Binding assays showed that 4-10 had subnanomolar K(i) values for mu and kappa opioid receptors. Functional assays for stimulation of [(35)S]GTPgammaS binding showed that several compounds acted as partial or inverse agonists and antagonists of the mu and delta, kappa opioid or NOP receptors. The compounds showed considerable stability in the presence of rat, mouse or human liver preparations and NADPH. The inhibitory activity on the functional activity of human cytochrome P450s was examined to determine any potential inhibition by 4-9. Only modest inhibition of CYP3A4, CYP2C9 and CYP2C19 was observed for a few of the analogs. As a representative example, radiolabeled 6 was examined in vivo and showed reasonable brain penetration. The inhibition of ethanol self-administration in rats trained to self-administer a 10% (w/v) ethanol solution, utilizing operant techniques showed 5-8 to have very potent efficacy (ED(50) values 19-50 microg/kg).",43,ChEMBL,CHEMBL1072487,20180911,5360515|44596169|46227960|46227962|46227964|46227965,103721251|103721252|103721253|103721254|103721255|131283791,4987,,P41146,Curation Efforts|Research and Development,19683449,0,,P41146,,45.0,,,0,0,1,1,1,1
207,453420,Confirmatory,Displacement of [3H]nociceptin from recombinant ORL1 receptor expressed in COS7 cells by competitive receptor binding assay,"Title: Spare interactions of highly potent [Arg(14),Lys(15)]nociceptin for cooperative induction of ORL1 receptor activation._||_Abstract: [Arg(14),Lys(15)]Nociceptin is a very potent for ORL1 receptor, showing a few times stronger binding activity and much more enhanced biological activity than endogenous nociceptin. This synergistic outcome has been suggested to be due to the interaction with the receptor aromatic and/or acidic amino acid residues crucial to receptor activation. In order to identify such receptor residues in the second ORL1 extracellular loop, we prepared a series of recombinant mutant receptors. The mutant receptor Gln205Ala was found to be as active as wild-type ORL1 for both nociceptin and [Arg(14),Lys(15)]nociceptin. In contrast, Asp206Ala and Tyr207Ala exhibited considerably reduced activity for [Arg(14),Lys(15)]nociceptin, exhibiting no synergistic activity enhancement. These results suggest that Asp206 and Tyr207 are directly involved in the interaction with nociceptin-[Arg(14),Lys(15)]. Trp208Ala was found to bind strongly both nociceptin and [Arg(14),Lys(15)]nociceptin, although it elicited no biological activity. All these results indicate that the consecutive amino acid residues Asp206, Tyr207, and Trp208 are critical to the activation of the ORL1 receptor, but not to nociceptin-binding.",43,ChEMBL,CHEMBL1072723,20180912,16131448,103532611,4987,,P41146,Curation Efforts|Research and Development,19879767,0,,P41146,,207.0,,,0,0,0,0,0,0
208,453607,Confirmatory,Binding affinity to recombinant ORL1 receptor expressed in COS7 cells by saturation binding assay,"Title: Spare interactions of highly potent [Arg(14),Lys(15)]nociceptin for cooperative induction of ORL1 receptor activation._||_Abstract: [Arg(14),Lys(15)]Nociceptin is a very potent for ORL1 receptor, showing a few times stronger binding activity and much more enhanced biological activity than endogenous nociceptin. This synergistic outcome has been suggested to be due to the interaction with the receptor aromatic and/or acidic amino acid residues crucial to receptor activation. In order to identify such receptor residues in the second ORL1 extracellular loop, we prepared a series of recombinant mutant receptors. The mutant receptor Gln205Ala was found to be as active as wild-type ORL1 for both nociceptin and [Arg(14),Lys(15)]nociceptin. In contrast, Asp206Ala and Tyr207Ala exhibited considerably reduced activity for [Arg(14),Lys(15)]nociceptin, exhibiting no synergistic activity enhancement. These results suggest that Asp206 and Tyr207 are directly involved in the interaction with nociceptin-[Arg(14),Lys(15)]. Trp208Ala was found to bind strongly both nociceptin and [Arg(14),Lys(15)]nociceptin, although it elicited no biological activity. All these results indicate that the consecutive amino acid residues Asp206, Tyr207, and Trp208 are critical to the activation of the ORL1 receptor, but not to nociceptin-binding.",43,ChEMBL,CHEMBL1068488,20180912,16131448,103532611,4987,,P41146,Curation Efforts|Research and Development,19879767,0,,P41146,,207.0,,,0,0,0,0,0,0
213,493590,Confirmatory,Displacement of [3H]nociceptin from human recombinant ORL1 receptor expressed in H recombinant HEK293 cells,"Title: A new group of oxime carbamates as reversible inhibitors of fatty acid amide hydrolase._||_Abstract: A series of oxime carbamates have been identified as potent inhibitors of fatty acid amide hydrolase (FAAH), an important regulatory enzyme of the endocannabinoid signaling system. Kinetic analysis indicates that they behave as non-competitive, reversible inhibitors, and show remarkable selectivity for FAAH over the other components of the endocannabinoid system.",43,ChEMBL,CHEMBL1212494,20180913,44469677,104238293,4987,,P41146,Curation Efforts|Research and Development,20591666,0,,P41146,9606.0,45.0,,,0,0,0,0,0,0
