,aid,aidtype,aidname,aiddesc,aidsrcid,aidsrcname,aidextid,aidmdate,cids,sids,geneids,aidcategories,protacxns,depcatg,pmids,rnai,ecs,repacxns,taxids,cellids,targettaxid,annotation,partial_agonist_desc,partial_agonist_aidname,agonist_desc,agonist_aidname,antagonist_desc,antagonist_aidname
3,82360,Literature-derived,Activity on Nociceptin/orphanin FQ (N/OFQ) receptor was determined by GTPgammaS functional assay using recombinant HEK293 cells; PA: Partial antagonist,Title: Design and synthesis of novel small molecule N/OFQ receptor antagonists._||_Abstract: Small molecule N/OFQ receptor antagonists were designed and synthesized to further investigate the therapeutic potential of N/OFQ receptor modulators. The resulting octahydrobenzimidazol-2-ones 14 and 23 show excellent antagonistic activity towards both N/OFQ and mu receptors with high affinity to the human N/OFQ receptor.,43,ChEMBL,CHEMBL691019,20181001,9880173|9902874|10133108|10154739,103198125|103198126|103198403|163316017,4987,,P41146,Curation Efforts|Research and Development,14980696,0,,P41146,9606.0,45.0,,,0,0,1,1,1,1
4,147406,Literature-derived,"Concentration required to stimulate [35S]GTP-gamma-S, binding to human NOP receptor in cell membrane","Title: The design and synthesis of a novel quinolizidine template for potent opioid and opioid receptor-like (ORL1, NOP) receptor ligands._||_Abstract: A new class of high affinity opioid and opioid receptor-like receptor (ORL1 receptor, NOP receptor) ligands has been designed by conformational restriction of piperidine-based NOP receptor ligands, resulting in a novel quinolizidine scaffold. Different modifications of the pendant functional groups on the scaffold provide differential activities at the opioid and NOP receptors. While the conformational rigidity will provide an improved understanding of the NOP and opioid receptor binding pockets, these compounds also provide a new template for the design of novel opiate and NOP ligands.",43,ChEMBL,CHEMBL752664,20200630,10066285|10407144|16131448|44297435|44297519|44297697|44297727,103239143|103239184|103239185|103239290|103239626|103239701|103532611,4987,,P41146,Curation Efforts|Research and Development,14684324,0,,P41146,,,,,0,0,0,0,0,0
9,147411,Confirmatory,Binding affinity for human nociceptin (NOP) receptor using [3H]N/OFQ as radioligand transfected into CHO cells,"Title: The design and synthesis of a novel quinolizidine template for potent opioid and opioid receptor-like (ORL1, NOP) receptor ligands._||_Abstract: A new class of high affinity opioid and opioid receptor-like receptor (ORL1 receptor, NOP receptor) ligands has been designed by conformational restriction of piperidine-based NOP receptor ligands, resulting in a novel quinolizidine scaffold. Different modifications of the pendant functional groups on the scaffold provide differential activities at the opioid and NOP receptors. While the conformational rigidity will provide an improved understanding of the NOP and opioid receptor binding pockets, these compounds also provide a new template for the design of novel opiate and NOP ligands.",43,ChEMBL,CHEMBL752669,20181001,10066285|10407144|16131448|44297435|44297519|44297539|44297697|44297727,103239143|103239184|103239185|103239290|103239325|103239626|103239701|103532611,4987,,P41146,Curation Efforts|Research and Development,14684324,0,,P41146,,197.0,,,0,0,0,0,0,0
12,147414,Literature-derived,"Stimulation of [35S]GTP-gamma-S, binding to human NOP receptor in cell membrane","Title: The design and synthesis of a novel quinolizidine template for potent opioid and opioid receptor-like (ORL1, NOP) receptor ligands._||_Abstract: A new class of high affinity opioid and opioid receptor-like receptor (ORL1 receptor, NOP receptor) ligands has been designed by conformational restriction of piperidine-based NOP receptor ligands, resulting in a novel quinolizidine scaffold. Different modifications of the pendant functional groups on the scaffold provide differential activities at the opioid and NOP receptors. While the conformational rigidity will provide an improved understanding of the NOP and opioid receptor binding pockets, these compounds also provide a new template for the design of novel opiate and NOP ligands.",43,ChEMBL,CHEMBL752672,20181001,10066285|10407144|16131448|44297435,103239143|103239184|103239185|103532611,4987,,P41146,Curation Efforts|Research and Development,14684324,0,,P41146,,,,,0,0,0,0,0,0
13,147416,Confirmatory,Ability to displace [125I]-Tyr14 at nociceptin (NOP) receptor,"Title: The design and synthesis of a novel quinolizidine template for potent opioid and opioid receptor-like (ORL1, NOP) receptor ligands._||_Abstract: A new class of high affinity opioid and opioid receptor-like receptor (ORL1 receptor, NOP receptor) ligands has been designed by conformational restriction of piperidine-based NOP receptor ligands, resulting in a novel quinolizidine scaffold. Different modifications of the pendant functional groups on the scaffold provide differential activities at the opioid and NOP receptors. While the conformational rigidity will provide an improved understanding of the NOP and opioid receptor binding pockets, these compounds also provide a new template for the design of novel opiate and NOP ligands.",43,ChEMBL,CHEMBL752673,20181001,416359,103238914,4987,,P41146,Curation Efforts|Research and Development,14684324,0,,P41146,,,,,0,0,0,0,0,0
19,147638,Literature-derived,"Functional [35S]GTP-gamma-S, binding for human ORL1 receptor carried out in CHO cell membranes.",Title: Synthesis and structure-activity relationships of aminoalkylazetidines as ORL1 receptor ligands._||_Abstract: A series of aminoalkylazetidines has been discovered as novel ORL1 receptor ligands. Structure-activity relationships have been investigated at the azetidine N and the alkyl side chain sites. Several potent and selective analogues have been identified.,43,ChEMBL,CHEMBL749955,20180930,10172398|10194236|10286996|44336905|44337108|44337123|44337131|44337229|44337351|44337357|44337379|44337452,103326789|103327278|103327280|103327307|103327309|103327326|103327373|103327521|103327795|103327810|103327852|103328016,4987,,P41146,Curation Efforts|Research and Development,12372523,0,,P41146,,197.0,,,0,0,0,0,0,0
21,147640,Literature-derived,"Functional [35S]GTP-gamma-S, binding for human ORL1 receptor carried out in CHO cell membranes.",Title: Synthesis and structure-activity relationships of aminoalkylazetidines as ORL1 receptor ligands._||_Abstract: A series of aminoalkylazetidines has been discovered as novel ORL1 receptor ligands. Structure-activity relationships have been investigated at the azetidine N and the alkyl side chain sites. Several potent and selective analogues have been identified.,43,ChEMBL,CHEMBL749957,20180930,10150001|10150260|10193971|10286440|44336906|44337129|44337130|44337163|44337230|44337231|44337232|44337249|44337252|44337362|44337459|44337460|44337461|44337473|44337513|44337550|44337551,103326790|103327299|103327322|103327323|103327346|103327391|103327486|103327527|103327528|103327530|103327551|103327558|103327815|103327840|103328036|103328037|103328038|103328056|103328150|103328238|103328239,4987,,P41146,Curation Efforts|Research and Development,12372523,0,,P41146,,197.0,,,0,0,0,0,0,0
24,147763,Confirmatory,"Compound was evaluated for increase in [35S]GTP-gamma-S, binding for human ORL1 receptor carried out in CHO cell membranes; Nd: no data",Title: Synthesis and structure-activity relationships of aminoalkylazetidines as ORL1 receptor ligands._||_Abstract: A series of aminoalkylazetidines has been discovered as novel ORL1 receptor ligands. Structure-activity relationships have been investigated at the azetidine N and the alkyl side chain sites. Several potent and selective analogues have been identified.,43,ChEMBL,CHEMBL756269,20180930,16131448,103532611,4987,,P41146,Curation Efforts|Research and Development,12372523,0,,P41146,,197.0,,,0,0,0,0,0,0
28,147767,Confirmatory,Inhibition of human ORL1 orphanin receptor,"Title: From hit to lead. Analyzing structure-profile relationships._||_Abstract: Two compounds, obtained by random screening, and displaying micromolar activities on the mu opiate receptor were used as starting points for optimization. In that work, the traditional concept of the activity of a compound (related to one or a few targets) was extended to the comprehensive pharmacological profile of that compound on more than 70 receptors, transporters, and channels relevant to a CNS-oriented project. Using the two complementary design strategies based on two similarity concepts described in the previous paper, we have obtained analogues with IC(50) values ranging between 0.9 nM and a few micromolar on the mu receptor and displaying qualitatively different profiles. We discuss here, both on a case-by-case basis and from a statistical standpoint, the pharmacological profiles in light of the two similarity concepts.",43,ChEMBL,CHEMBL756273,20181017,10004950|10905740|10937901|10948527|10949380|10981761|11143820|11811722|44342270,103338362|103338363|103338365|103338403|103338611|103338860|103339117|103339119|103339458,4987,,P41146,Curation Efforts|Research and Development,11585444,0,,P41146,9606.0,,,,0,0,0,0,0,0
30,147769,Literature-derived,Concentration of compound that inhibits the binding of human ORL1 receptor in CHO cell membranes in the presence of [125I]nociceptin radioligand at a concentration of 10 uM,Title: Synthesis and structure-activity relationships of aminoalkylazetidines as ORL1 receptor ligands._||_Abstract: A series of aminoalkylazetidines has been discovered as novel ORL1 receptor ligands. Structure-activity relationships have been investigated at the azetidine N and the alkyl side chain sites. Several potent and selective analogues have been identified.,43,ChEMBL,CHEMBL756275,20180930,44336906|44337130,103326790|103327323,4987,,P41146,Curation Efforts|Research and Development,12372523,0,,P41146,,197.0,,,0,0,0,0,0,0
31,147770,Confirmatory,Binding affinity at human ORL1 receptor was determined by using [125I]nociceptin radioligand in Chinese hamster ovary (CHO) cell membranes at a concentration of 23 pM,Title: Synthesis and structure-activity relationships of aminoalkylazetidines as ORL1 receptor ligands._||_Abstract: A series of aminoalkylazetidines has been discovered as novel ORL1 receptor ligands. Structure-activity relationships have been investigated at the azetidine N and the alkyl side chain sites. Several potent and selective analogues have been identified.,43,ChEMBL,CHEMBL756276,20180930,10150001|10150260|10172398|10193971|10194236|10286440|10286996|44336905|44337108|44337123|44337129|44337131|44337163|44337212|44337229|44337230|44337231|44337232|44337249|44337252|44337351|44337357|44337362|44337379|44337437|44337452|44337459|44337460|44337461|44337473|44337513|44337550|44337551,103326789|103327278|103327280|103327299|103327307|103327309|103327322|103327326|103327346|103327373|103327391|103327485|103327486|103327521|103327527|103327528|103327530|103327551|103327558|103327795|103327810|103327815|103327840|103327852|103327982|103328016|103328036|103328037|103328038|103328056|103328150|103328238|103328239,4987,,P41146,Curation Efforts|Research and Development,12372523,0,,P41146,,,,,0,0,0,0,0,0
42,148863,Confirmatory,"Antagonistic activity against nociceptin produced [35S]GTP-gamma-S, binding to Opioid receptor like 1 expressed in CHO cells","Title: Discovery of the first potent and selective small molecule opioid receptor-like (ORL1) antagonist: 1-[(3R,4R)-1-cyclooctylmethyl-3- hydroxymethyl-4-piperidyl]-3-ethyl-1, 3-dihydro-2H-benzimidazol-2-one (J-113397).",43,ChEMBL,CHEMBL754580,20181016,416359|5311194|9887195|10832076,103238914|103391515|103392033|103392062,4987,,P41146,Curation Efforts|Research and Development,10602690,0,,P41146,,197.0,,,0,0,1,1,1,1
43,148864,Confirmatory,Antagonistic activity measured by GTPgammaS binding against Opioid receptor like 1 in CHO cells,"Title: Discovery of the first potent and selective small molecule opioid receptor-like (ORL1) antagonist: 1-[(3R,4R)-1-cyclooctylmethyl-3- hydroxymethyl-4-piperidyl]-3-ethyl-1, 3-dihydro-2H-benzimidazol-2-one (J-113397).",43,ChEMBL,CHEMBL857695,20181016,10451761|10783436,103391044|103392095,4987,,P41146,Curation Efforts|Research and Development,10602690,0,,P41146,,197.0,,,0,0,1,1,1,1
46,148867,Confirmatory,Antagonist activity toward human Opioid receptor like 1,Title: Probing opioid receptor interactions with azacycloalkane amino acids. Synthesis of a potent and selective ORL1 antagonist._||_Abstract: Azacycloalkane turn mimics 6-9 were used to explore the relationship between conformation and biological activity of peptide ligands to the opioid receptor-like (ORL1) receptor. Three azabicyclo[x.y.0]alkane amino acids and a 5-tBuPro type VI beta-turn mimic were introduced into peptides 10-13 by solid-phase synthesis on MBHA resin. Biological examination of peptides 10-13 showed two new antagonists (10 and 12) exhibiting increased selectivity for the ORL1 receptor.,43,ChEMBL,CHEMBL754583,20181017,44366822|44366823,103396704|103396705,4987,,P41146,Curation Efforts|Research and Development,12431062,0,,P41146,,,,,0,0,1,1,1,1
60,151024,Confirmatory,Antagonistic activity against orphan FQ receptor,"Title: Design and parallel synthesis of piperidine libraries targeting the nociceptin (N/OFQ) receptor._||_Abstract: Based on literature structures, we proposed a pharmacophore for NOP receptor ligands and used it as a guide for the design of a focused piperidine library and an optimization library. Potent NOP receptor agonists and antagonists were obtained from these libraries as well as a few potent, mu selective agonists.",43,ChEMBL,CHEMBL750188,20181001,11743914|44339374|44339423|44339424|44339425|44339504|44339576|44339596|44339684|44339695,103332287|103332445|103332446|103332447|103332448|103332639|103332801|103332835|103333029|103333051,4987,,P41146,Curation Efforts|Research and Development,12951102,0,,P41146,,,,,0,0,1,1,1,1
68,239895,Literature-derived,Antagonistic potency against N/OFQ induced GTPgammaS binding to human NOP receptor expressed in CHO cell membranes,"Title: N- and C-terminal modifications of nociceptin/orphanin FQ generate highly potent NOP receptor ligands._||_Abstract: Previous structure-activity studies on nociceptin/orphanin FQ (N/OFQ) identified [Phe(1)Psi(CH(2)NH)Gly(2)]N/OFQ(1-13)-NH(2) and [Nphe(1)]N/OFQ(1-13)-NH(2) as a N/OFQ peptide receptor (NOP) partial agonist and pure antagonist, respectively. The addition of fluorine to the Phe(4) or the insertion of a further pair of basic amino acids Arg(14)-Lys(15) generate potent agonists. On the basis of these findings, we combined in the N/OFQ-NH(2) template the chemical modifications Arg(14)-Lys(15) and (pF)Phe(4) that increase the agonist potency with those conferring partial agonist (Phe(1)Psi(CH(2)NH)Gly(2)) or pure antagonist (Nphe(1)) properties. Twelve peptides were synthesized and pharmacologically evaluated in Chinese hamster ovary cells expressing the human recombinant NOP and in electrically stimulated mouse vas deferens and guinea pig ileum assays. All peptides behaved as NOP ligands; the chemical modifications Arg(14)-Lys(15) and (pF)Phe(4) increased ligand affinity/potency. Peptides with the normal Phe(1)-Gly(2) peptide bond behaved as full agonists, and those with the Phe(1)Psi(CH(2)NH)Gly(2) modification behaved as partial agonists, while those with the Nphe(1) modification behaved as partial agonists or pure antagonists depending on the presence or absence of the (pF)Phe(4) modification, respectively. The full agonist [(pF)Phe(4),Arg(14),Lys(15)]N/OFQ-NH(2), the partial agonist [Phe(1)Psi(CH(2)NH)Gly(2),(pF)Phe(4),Arg(14),Lys(15)]N/OFQ-NH(2), and the pure antagonist [Nphe(1),Arg(14),Lys(15)]N/OFQ-NH(2) represent the most potent peptide ligands for NOP.",43,ChEMBL,CHEMBL838629,20181018,16131448|44327446|44388460|44388461|44388462|44388465|44388466|44388467,103307743|103441633|103441634|103441635|103441642|103441643|103441644|103532611,4987,,P41146,Curation Efforts|Research and Development,15743186,0,,P41146,9606.0,197.0,,,1,0,1,1,1,1
69,239896,Literature-derived,Antagonistic potency against N/OFQ induced GTPgammaS binding to human NOP receptor expressed in CHO cell membranes at 1 uM,"Title: N- and C-terminal modifications of nociceptin/orphanin FQ generate highly potent NOP receptor ligands._||_Abstract: Previous structure-activity studies on nociceptin/orphanin FQ (N/OFQ) identified [Phe(1)Psi(CH(2)NH)Gly(2)]N/OFQ(1-13)-NH(2) and [Nphe(1)]N/OFQ(1-13)-NH(2) as a N/OFQ peptide receptor (NOP) partial agonist and pure antagonist, respectively. The addition of fluorine to the Phe(4) or the insertion of a further pair of basic amino acids Arg(14)-Lys(15) generate potent agonists. On the basis of these findings, we combined in the N/OFQ-NH(2) template the chemical modifications Arg(14)-Lys(15) and (pF)Phe(4) that increase the agonist potency with those conferring partial agonist (Phe(1)Psi(CH(2)NH)Gly(2)) or pure antagonist (Nphe(1)) properties. Twelve peptides were synthesized and pharmacologically evaluated in Chinese hamster ovary cells expressing the human recombinant NOP and in electrically stimulated mouse vas deferens and guinea pig ileum assays. All peptides behaved as NOP ligands; the chemical modifications Arg(14)-Lys(15) and (pF)Phe(4) increased ligand affinity/potency. Peptides with the normal Phe(1)-Gly(2) peptide bond behaved as full agonists, and those with the Phe(1)Psi(CH(2)NH)Gly(2) modification behaved as partial agonists, while those with the Nphe(1) modification behaved as partial agonists or pure antagonists depending on the presence or absence of the (pF)Phe(4) modification, respectively. The full agonist [(pF)Phe(4),Arg(14),Lys(15)]N/OFQ-NH(2), the partial agonist [Phe(1)Psi(CH(2)NH)Gly(2),(pF)Phe(4),Arg(14),Lys(15)]N/OFQ-NH(2), and the pure antagonist [Nphe(1),Arg(14),Lys(15)]N/OFQ-NH(2) represent the most potent peptide ligands for NOP.",43,ChEMBL,CHEMBL838630,20200703,44327819|44388472,103308378|103441651,4987,,P41146,Curation Efforts|Research and Development,15743186,0,,P41146,9606.0,197.0,,,1,0,1,1,1,1
70,239897,Literature-derived,Antagonistic potency against N/OFQ induced GTPgammaS binding to human NOP receptor expressed in CHO cell membranes at 0.1 uM,"Title: N- and C-terminal modifications of nociceptin/orphanin FQ generate highly potent NOP receptor ligands._||_Abstract: Previous structure-activity studies on nociceptin/orphanin FQ (N/OFQ) identified [Phe(1)Psi(CH(2)NH)Gly(2)]N/OFQ(1-13)-NH(2) and [Nphe(1)]N/OFQ(1-13)-NH(2) as a N/OFQ peptide receptor (NOP) partial agonist and pure antagonist, respectively. The addition of fluorine to the Phe(4) or the insertion of a further pair of basic amino acids Arg(14)-Lys(15) generate potent agonists. On the basis of these findings, we combined in the N/OFQ-NH(2) template the chemical modifications Arg(14)-Lys(15) and (pF)Phe(4) that increase the agonist potency with those conferring partial agonist (Phe(1)Psi(CH(2)NH)Gly(2)) or pure antagonist (Nphe(1)) properties. Twelve peptides were synthesized and pharmacologically evaluated in Chinese hamster ovary cells expressing the human recombinant NOP and in electrically stimulated mouse vas deferens and guinea pig ileum assays. All peptides behaved as NOP ligands; the chemical modifications Arg(14)-Lys(15) and (pF)Phe(4) increased ligand affinity/potency. Peptides with the normal Phe(1)-Gly(2) peptide bond behaved as full agonists, and those with the Phe(1)Psi(CH(2)NH)Gly(2) modification behaved as partial agonists, while those with the Nphe(1) modification behaved as partial agonists or pure antagonists depending on the presence or absence of the (pF)Phe(4) modification, respectively. The full agonist [(pF)Phe(4),Arg(14),Lys(15)]N/OFQ-NH(2), the partial agonist [Phe(1)Psi(CH(2)NH)Gly(2),(pF)Phe(4),Arg(14),Lys(15)]N/OFQ-NH(2), and the pure antagonist [Nphe(1),Arg(14),Lys(15)]N/OFQ-NH(2) represent the most potent peptide ligands for NOP.",43,ChEMBL,CHEMBL838631,20200703,44388473|44388474,103441652|103441653,4987,,P41146,Curation Efforts|Research and Development,15743186,0,,P41146,9606.0,197.0,,,1,0,1,1,1,1
79,245853,Literature-derived,Antagonistic potency against forskolin stimulated cAMP levels in CHO cell membranes expressing human NOP receptor (CHOhNOP) at 1 uM,"Title: N- and C-terminal modifications of nociceptin/orphanin FQ generate highly potent NOP receptor ligands._||_Abstract: Previous structure-activity studies on nociceptin/orphanin FQ (N/OFQ) identified [Phe(1)Psi(CH(2)NH)Gly(2)]N/OFQ(1-13)-NH(2) and [Nphe(1)]N/OFQ(1-13)-NH(2) as a N/OFQ peptide receptor (NOP) partial agonist and pure antagonist, respectively. The addition of fluorine to the Phe(4) or the insertion of a further pair of basic amino acids Arg(14)-Lys(15) generate potent agonists. On the basis of these findings, we combined in the N/OFQ-NH(2) template the chemical modifications Arg(14)-Lys(15) and (pF)Phe(4) that increase the agonist potency with those conferring partial agonist (Phe(1)Psi(CH(2)NH)Gly(2)) or pure antagonist (Nphe(1)) properties. Twelve peptides were synthesized and pharmacologically evaluated in Chinese hamster ovary cells expressing the human recombinant NOP and in electrically stimulated mouse vas deferens and guinea pig ileum assays. All peptides behaved as NOP ligands; the chemical modifications Arg(14)-Lys(15) and (pF)Phe(4) increased ligand affinity/potency. Peptides with the normal Phe(1)-Gly(2) peptide bond behaved as full agonists, and those with the Phe(1)Psi(CH(2)NH)Gly(2) modification behaved as partial agonists, while those with the Nphe(1) modification behaved as partial agonists or pure antagonists depending on the presence or absence of the (pF)Phe(4) modification, respectively. The full agonist [(pF)Phe(4),Arg(14),Lys(15)]N/OFQ-NH(2), the partial agonist [Phe(1)Psi(CH(2)NH)Gly(2),(pF)Phe(4),Arg(14),Lys(15)]N/OFQ-NH(2), and the pure antagonist [Nphe(1),Arg(14),Lys(15)]N/OFQ-NH(2) represent the most potent peptide ligands for NOP.",43,ChEMBL,CHEMBL834720,20200703,16131448|44327446|44327819|44388460|44388461|44388462|44388465|44388466|44388467|44388472|44388473|44388474,103307743|103308378|103441633|103441634|103441635|103441642|103441643|103441644|103441651|103441652|103441653|103532611,4987,,P41146,Curation Efforts|Research and Development,15743186,0,,P41146,,197.0,,,1,0,1,1,1,1
96,258752,Confirmatory,Displacement of [3H]NOP from human NOP receptor expressed in HEK293 cells,"Title: Discovery of N-(2-aryl-cyclohexyl) substituted spiropiperidines as a novel class of GlyT1 inhibitors._||_Abstract: Screening of the Roche compound library led to the identification of cis-N-(2-phenyl-cyclohexyl)-spiropiperidine 1 as structurally novel GlyT1 inhibitor. The SAR, which was developed in this series, resulted in the discovery of highly potent compounds displaying excellent selectivity against the GlyT2 isoform.",43,ChEMBL,CHEMBL864596,20181020,11406629|44406489|44406585|44406618|44406641|44406719,103475983|103476151|103476227|103476299|103476451|103476570,4987,,P41146,Curation Efforts|Research and Development,16246557,0,,P41146,9606.0,45.0,,,0,0,0,0,0,0
98,259848,Confirmatory,Antagonist activity on nociceptin-induced [35S]GTP-gamma-S binding to ORL1 expressed in CHO cells,"Title: Identification of a novel spiropiperidine opioid receptor-like 1 antagonist class by a focused library approach featuring 3D-pharmacophore similarity._||_Abstract: A focused library approach identifying novel leads to develop a potent ORL1 antagonist is described. Beginning from a compound identified by random screening, an exploratory library that exhibited a diverse display of pharmacophores was designed. After evaluating ORL1 antagonistic activity, a highly focused library was designed based on 3D-pharmacophore similarity to known actives. A novel D-proline amide class was identified in this library and was found to possess potent ORL1 antagonistic activity.",43,ChEMBL,CHEMBL865853,20181020,5311194|10296561|11511090|11525624|11583016|11597677|11619553|11633324,103392033|103477765|103477819|103478124|103478141|103478142|103478189|103478333,4987,,P41146,Curation Efforts|Research and Development,16451050,0,,P41146,9606.0,197.0,,,0,0,1,1,1,1
106,268009,Confirmatory,Antagonist activity against ORL1 receptor by GTPgammaS assay,"Title: Design, synthesis, and biological evaluation of indole derivatives as novel nociceptin/orphanin FQ (N/OFQ) receptor antagonists._||_Abstract: A novel series of 2-(1,2,4-oxadiazol-5-yl)-1H-indole derivatives as nociceptin/orphanin FQ (N/OFQ) receptor antagonists was discovered. Systematic modification of our original lead by changing the pendant functional groups, linker, heterocyclic core, and basic side chain revealed the structure-activity requirements for this novel template and resulted in the identification of more potent analog with improved potency as compared to the parent compound.",43,ChEMBL,CHEMBL871576,20181020,135458466|136043759|136043779|136043780|136043782|136043788|136043800|136043819,103490980|103491750|103491751|103491832|103492141|103492170|103492375|103492539,4987,,P41146,Curation Efforts|Research and Development,16621546,0,,P41146,9606.0,,,,0,0,1,1,1,1
